12:06:20.250329 IP 192.168.1.16.56776 > 192.168.1.22.8000: tcp 0
12:06:20.250387 IP 192.168.1.22.8000 > 192.168.1.16.56776: tcp 0
12:06:20.252444 IP 192.168.1.16.56776 > 192.168.1.22.8000: tcp 0
12:06:20.253682 IP 192.168.1.16.56776 > 192.168.1.22.8000: tcp 1056
12:06:20.253760 IP 192.168.1.22.8000 > 192.168.1.16.56776: tcp 0
12:06:20.289015 IP 192.168.1.22.8000 > 192.168.1.16.56776: tcp 941
12:06:20.289205 IP 192.168.1.22.8000 > 192.168.1.16.56776: tcp 7300
12:06:20.289360 IP 192.168.1.22.8000 > 192.168.1.16.56776: tcp 5840
12:06:20.291568 IP 192.168.1.22.8000 > 192.168.1.16.56776: tcp 1145
12:06:20.291951 IP 192.168.1.16.56776 > 192.168.1.22.8000: tcp 0
12:06:20.292765 IP 192.168.1.16.56776 > 192.168.1.22.8000: tcp 0
12:06:20.292787 IP 192.168.1.16.56776 > 192.168.1.22.8000: tcp 0
12:06:20.292792 IP 192.168.1.16.56776 > 192.168.1.22.8000: tcp 0
12:06:20.293432 IP 192.168.1.16.56776 > 192.168.1.22.8000: tcp 0
12:06:20.293474 IP 192.168.1.16.56776 > 192.168.1.22.8000: tcp 0
12:06:20.293857 IP 192.168.1.16.56776 > 192.168.1.22.8000: tcp 0
12:06:20.293882 IP 192.168.1.22.8000 > 192.168.1.16.56776: tcp 0
12:06:20.358843 IP 192.168.1.16.56777 > 192.168.1.22.8000: tcp 0
12:06:20.358863 IP 192.168.1.22.8000 > 192.168.1.16.56777: tcp 0
12:06:20.359152 IP 192.168.1.16.56778 > 192.168.1.22.8000: tcp 0
12:06:20.359160 IP 192.168.1.22.8000 > 192.168.1.16.56778: tcp 0
12:06:20.359169 IP 192.168.1.16.56779 > 192.168.1.22.8000: tcp 0
12:06:20.359172 IP 192.168.1.22.8000 > 192.168.1.16.56779: tcp 0
12:06:20.359177 IP 192.168.1.16.56780 > 192.168.1.22.8000: tcp 0
12:06:20.359180 IP 192.168.1.22.8000 > 192.168.1.16.56780: tcp 0
12:06:20.359188 IP 192.168.1.16.56781 > 192.168.1.22.8000: tcp 0
12:06:20.363303 IP 192.168.1.16.56777 > 192.168.1.22.8000: tcp 0
12:06:20.364121 IP 192.168.1.16.56778 > 192.168.1.22.8000: tcp 0
12:06:20.364141 IP 192.168.1.16.56781 > 192.168.1.22.8000: tcp 0
12:06:20.364144 IP 192.168.1.16.56779 > 192.168.1.22.8000: tcp 0
12:06:20.364146 IP 192.168.1.16.56782 > 192.168.1.22.8000: tcp 0
12:06:20.364150 IP 192.168.1.16.56780 > 192.168.1.22.8000: tcp 0
12:06:20.364152 IP 192.168.1.16.56777 > 192.168.1.22.8000: tcp 995
12:06:20.364158 IP 192.168.1.22.8000 > 192.168.1.16.56777: tcp 0
12:06:20.364472 IP 192.168.1.16.56781 > 192.168.1.22.8000: tcp 993
12:06:20.364478 IP 192.168.1.22.8000 > 192.168.1.16.56781: tcp 0
12:06:20.364756 IP 192.168.1.22.8000 > 192.168.1.16.56777: tcp 126
12:06:20.364825 IP 192.168.1.22.8000 > 192.168.1.16.56778: tcp 125
12:06:20.364981 IP 192.168.1.22.8000 > 192.168.1.16.56777: tcp 5840
12:06:20.365017 IP 192.168.1.22.8000 > 192.168.1.16.56777: tcp 5840
12:06:20.365025 IP 192.168.1.22.8000 > 192.168.1.16.56777: tcp 1460
12:06:20.365143 IP 192.168.1.22.8000 > 192.168.1.16.56778: tcp 5840
12:06:20.365200 IP 192.168.1.22.8000 > 192.168.1.16.56778: tcp 5840
12:06:20.365207 IP 192.168.1.22.8000 > 192.168.1.16.56778: tcp 1460
12:06:20.365258 IP 192.168.1.22.8000 > 192.168.1.16.56781: tcp 124
12:06:20.365327 IP 192.168.1.22.8000 > 192.168.1.16.56781: tcp 5840
12:06:20.365435 IP 192.168.1.22.8000 > 192.168.1.16.56781: tcp 1232
12:06:20.373343 IP 192.168.1.16.56779 > 192.168.1.22.8000: tcp 1003
12:06:20.373380 IP 192.168.1.22.8000 > 192.168.1.16.56779: tcp 0
12:06:20.373394 IP 192.168.1.16.56780 > 192.168.1.22.8000: tcp 1012
12:06:20.373413 IP 192.168.1.22.8000 > 192.168.1.16.56780: tcp 0
12:06:20.373424 IP 192.168.1.16.56782 > 192.168.1.22.8000: tcp 983
12:06:20.373427 IP 192.168.1.22.8000 > 192.168.1.16.56782: tcp 0
12:06:20.373974 IP 192.168.1.22.8000 > 192.168.1.16.56780: tcp 123
12:06:20.374063 IP 192.168.1.22.8000 > 192.168.1.16.56779: tcp 125
12:06:20.374124 IP 192.168.1.22.8000 > 192.168.1.16.56782: tcp 124
12:06:20.374185 IP 192.168.1.22.8000 > 192.168.1.16.56779: tcp 5840
12:06:20.374223 IP 192.168.1.22.8000 > 192.168.1.16.56779: tcp 5840
12:06:20.374231 IP 192.168.1.22.8000 > 192.168.1.16.56779: tcp 1460
12:06:20.374348 IP 192.168.1.22.8000 > 192.168.1.16.56782: tcp 5840
12:06:20.374455 IP 192.168.1.22.8000 > 192.168.1.16.56780: tcp 737
12:06:20.374535 IP 192.168.1.22.8000 > 192.168.1.16.56782: tcp 309
12:06:20.377166 IP 192.168.1.16.56777 > 192.168.1.22.8000: tcp 0
12:06:20.377178 IP 192.168.1.22.8000 > 192.168.1.16.56777: tcp 5840
12:06:20.377190 IP 192.168.1.16.56777 > 192.168.1.22.8000: tcp 0
12:06:20.377193 IP 192.168.1.22.8000 > 192.168.1.16.56777: tcp 5840
12:06:20.377201 IP 192.168.1.16.56777 > 192.168.1.22.8000: tcp 0
12:06:20.377203 IP 192.168.1.16.56777 > 192.168.1.22.8000: tcp 0
12:06:20.377205 IP 192.168.1.16.56777 > 192.168.1.22.8000: tcp 0
12:06:20.377322 IP 192.168.1.22.8000 > 192.168.1.16.56778: tcp 7300
12:06:20.377347 IP 192.168.1.22.8000 > 192.168.1.16.56777: tcp 5840
12:06:20.377355 IP 192.168.1.22.8000 > 192.168.1.16.56777: tcp 5840
12:06:20.377386 IP 192.168.1.22.8000 > 192.168.1.16.56777: tcp 5840
12:06:20.377392 IP 192.168.1.22.8000 > 192.168.1.16.56778: tcp 1460
12:06:20.380922 IP 192.168.1.22.8000 > 192.168.1.16.56781: tcp 1232
12:06:20.381851 IP 192.168.1.16.56778 > 192.168.1.22.8000: tcp 0
12:06:20.381891 IP 192.168.1.22.8000 > 192.168.1.16.56778: tcp 2920
12:06:20.390297 IP 192.168.1.16.56778 > 192.168.1.22.8000: tcp 0
12:06:20.390338 IP 192.168.1.22.8000 > 192.168.1.16.56778: tcp 2193
12:06:20.390358 IP 192.168.1.16.56778 > 192.168.1.22.8000: tcp 0
12:06:20.390361 IP 192.168.1.16.56778 > 192.168.1.22.8000: tcp 0
12:06:20.390364 IP 192.168.1.16.56781 > 192.168.1.22.8000: tcp 0
12:06:20.390368 IP 192.168.1.16.56781 > 192.168.1.22.8000: tcp 0
12:06:20.390382 IP 192.168.1.16.56781 > 192.168.1.22.8000: tcp 0
12:06:20.390840 IP 192.168.1.16.56779 > 192.168.1.22.8000: tcp 0
12:06:20.390846 IP 192.168.1.16.56779 > 192.168.1.22.8000: tcp 0
12:06:20.390848 IP 192.168.1.16.56779 > 192.168.1.22.8000: tcp 0
12:06:20.390850 IP 192.168.1.16.56782 > 192.168.1.22.8000: tcp 0
12:06:20.390852 IP 192.168.1.16.56782 > 192.168.1.22.8000: tcp 0
12:06:20.390853 IP 192.168.1.16.56780 > 192.168.1.22.8000: tcp 0
12:06:20.390856 IP 192.168.1.16.56782 > 192.168.1.22.8000: tcp 0
12:06:20.396615 IP 192.168.1.16.56778 > 192.168.1.22.8000: tcp 0
12:06:20.396635 IP 192.168.1.16.56777 > 192.168.1.22.8000: tcp 0
12:06:20.396642 IP 192.168.1.22.8000 > 192.168.1.16.56777: tcp 5840
12:06:20.396658 IP 192.168.1.16.56777 > 192.168.1.22.8000: tcp 0
12:06:20.396660 IP 192.168.1.22.8000 > 192.168.1.16.56777: tcp 5840
12:06:20.396680 IP 192.168.1.16.56777 > 192.168.1.22.8000: tcp 0
12:06:20.396682 IP 192.168.1.16.56777 > 192.168.1.22.8000: tcp 0
12:06:20.396821 IP 192.168.1.22.8000 > 192.168.1.16.56777: tcp 5840
12:06:20.396875 IP 192.168.1.22.8000 > 192.168.1.16.56777: tcp 7300
12:06:20.396883 IP 192.168.1.22.8000 > 192.168.1.16.56777: tcp 7300
12:06:20.396975 IP 192.168.1.16.56778 > 192.168.1.22.8000: tcp 0
12:06:20.396985 IP 192.168.1.16.56778 > 192.168.1.22.8000: tcp 0
12:06:20.396991 IP 192.168.1.22.8000 > 192.168.1.16.56778: tcp 0
12:06:20.397003 IP 192.168.1.16.56786 > 192.168.1.22.8000: tcp 0
12:06:20.397998 IP 192.168.1.22.8000 > 192.168.1.16.56783: tcp 123
12:06:20.398185 IP 192.168.1.22.8000 > 192.168.1.16.56785: tcp 124
12:06:20.398256 IP 192.168.1.22.8000 > 192.168.1.16.56783: tcp 559
12:06:20.398295 IP 192.168.1.22.8000 > 192.168.1.16.56785: tcp 2920
12:06:20.398334 IP 192.168.1.22.8000 > 192.168.1.16.56785: tcp 2920
12:06:20.398393 IP 192.168.1.22.8000 > 192.168.1.16.56784: tcp 123
12:06:20.398444 IP 192.168.1.22.8000 > 192.168.1.16.56785: tcp 960
12:06:20.398501 IP 192.168.1.22.8000 > 192.168.1.16.56784: tcp 443
12:06:20.401032 IP 192.168.1.16.56777 > 192.168.1.22.8000: tcp 0
12:06:20.401058 IP 192.168.1.16.56777 > 192.168.1.22.8000: tcp 0
12:06:20.401060 IP 192.168.1.16.56777 > 192.168.1.22.8000: tcp 0
12:06:20.401062 IP 192.168.1.16.56777 > 192.168.1.22.8000: tcp 0
12:06:20.401063 IP 192.168.1.16.56777 > 192.168.1.22.8000: tcp 0
12:06:20.401064 IP 192.168.1.16.56777 > 192.168.1.22.8000: tcp 0
12:06:20.404616 IP 192.168.1.16.56777 > 192.168.1.22.8000: tcp 0
12:06:20.404636 IP 192.168.1.16.56777 > 192.168.1.22.8000: tcp 0
12:06:20.404639 IP 192.168.1.16.56777 > 192.168.1.22.8000: tcp 0
12:06:20.404640 IP 192.168.1.16.56777 > 192.168.1.22.8000: tcp 0
12:06:20.405371 IP 192.168.1.16.56777 > 192.168.1.22.8000: tcp 0
12:06:20.405384 IP 192.168.1.16.56777 > 192.168.1.22.8000: tcp 0
12:06:20.405387 IP 192.168.1.16.56777 > 192.168.1.22.8000: tcp 0
12:06:20.405389 IP 192.168.1.16.56777 > 192.168.1.22.8000: tcp 0
12:06:20.405390 IP 192.168.1.16.56786 > 192.168.1.22.8000: tcp 0
12:06:20.405594 IP 192.168.1.16.56786 > 192.168.1.22.8000: tcp 983
12:06:20.405606 IP 192.168.1.22.8000 > 192.168.1.16.56786: tcp 0
12:06:20.405620 IP 192.168.1.16.56777 > 192.168.1.22.8000: tcp 0
12:06:20.405624 IP 192.168.1.16.56777 > 192.168.1.22.8000: tcp 0
12:06:20.405630 IP 192.168.1.16.56787 > 192.168.1.22.8000: tcp 0
12:06:20.405636 IP 192.168.1.16.56783 > 192.168.1.22.8000: tcp 0
12:06:20.405640 IP 192.168.1.16.56777 > 192.168.1.22.8000: tcp 0
12:06:20.405950 IP 192.168.1.22.8000 > 192.168.1.16.56786: tcp 126
12:06:20.406058 IP 192.168.1.22.8000 > 192.168.1.16.56786: tcp 2920
12:06:20.406103 IP 192.168.1.22.8000 > 192.168.1.16.56786: tcp 2920
12:06:20.406141 IP 192.168.1.22.8000 > 192.168.1.16.56786: tcp 2920
12:06:20.406217 IP 192.168.1.16.56787 > 192.168.1.22.8000: tcp 994
12:06:20.406223 IP 192.168.1.22.8000 > 192.168.1.16.56787: tcp 0
12:06:20.406233 IP 192.168.1.16.56785 > 192.168.1.22.8000: tcp 0
12:06:20.406239 IP 192.168.1.16.56784 > 192.168.1.22.8000: tcp 0
12:06:20.406510 IP 192.168.1.22.8000 > 192.168.1.16.56787: tcp 124
12:06:20.406702 IP 192.168.1.22.8000 > 192.168.1.16.56787: tcp 2920
12:06:20.406769 IP 192.168.1.22.8000 > 192.168.1.16.56787: tcp 2920
12:06:20.406860 IP 192.168.1.22.8000 > 192.168.1.16.56787: tcp 74
12:06:20.410717 IP 192.168.1.16.56785 > 192.168.1.22.8000: tcp 0
12:06:20.410740 IP 192.168.1.22.8000 > 192.168.1.16.56785: tcp 0
12:06:20.411809 IP 192.168.1.16.56788 > 192.168.1.22.8000: tcp 0
12:06:20.411850 IP 192.168.1.16.56789 > 192.168.1.22.8000: tcp 0
12:06:20.411860 IP 192.168.1.22.8000 > 192.168.1.16.56789: tcp 0
12:06:20.411877 IP 192.168.1.16.56783 > 192.168.1.22.8000: tcp 0
12:06:20.411883 IP 192.168.1.22.8000 > 192.168.1.16.56783: tcp 0
12:06:20.411891 IP 192.168.1.16.56790 > 192.168.1.22.8000: tcp 0
12:06:20.411894 IP 192.168.1.22.8000 > 192.168.1.16.56790: tcp 0
12:06:20.412483 IP 192.168.1.22.8000 > 192.168.1.16.56788: tcp 124
12:06:20.412570 IP 192.168.1.22.8000 > 192.168.1.16.56788: tcp 5840
12:06:20.412613 IP 192.168.1.22.8000 > 192.168.1.16.56788: tcp 5840
12:06:20.412622 IP 192.168.1.22.8000 > 192.168.1.16.56788: tcp 1460
12:06:20.418939 IP 192.168.1.16.56792 > 192.168.1.22.8000: tcp 0
12:06:20.418960 IP 192.168.1.22.8000 > 192.168.1.16.56792: tcp 0
12:06:20.419295 IP 192.168.1.16.56789 > 192.168.1.22.8000: tcp 0
12:06:20.419310 IP 192.168.1.16.56790 > 192.168.1.22.8000: tcp 0
12:06:20.419416 IP 192.168.1.16.56789 > 192.168.1.22.8000: tcp 987
12:06:20.419444 IP 192.168.1.22.8000 > 192.168.1.16.56789: tcp 0
12:06:20.419609 IP 192.168.1.16.56790 > 192.168.1.22.8000: tcp 979
12:06:20.419613 IP 192.168.1.22.8000 > 192.168.1.16.56790: tcp 0
12:06:20.419645 IP 192.168.1.16.56786 > 192.168.1.22.8000: tcp 0
12:06:20.419650 IP 192.168.1.22.8000 > 192.168.1.16.56786: tcp 2920
12:06:20.421120 IP 192.168.1.22.8000 > 192.168.1.16.56789: tcp 123
12:06:20.421187 IP 192.168.1.16.56791 > 192.168.1.22.8000: tcp 976
12:06:20.421197 IP 192.168.1.22.8000 > 192.168.1.16.56791: tcp 0
12:06:20.421208 IP 192.168.1.16.56786 > 192.168.1.22.8000: tcp 0
12:06:20.421215 IP 192.168.1.22.8000 > 192.168.1.16.56786: tcp 5840
12:06:20.421222 IP 192.168.1.16.56786 > 192.168.1.22.8000: tcp 0
12:06:20.421225 IP 192.168.1.16.56786 > 192.168.1.22.8000: tcp 0
12:06:20.422062 IP 192.168.1.22.8000 > 192.168.1.16.56789: tcp 2920
12:06:20.423475 IP 192.168.1.16.56788 > 192.168.1.22.8000: tcp 0
12:06:20.423498 IP 192.168.1.22.8000 > 192.168.1.16.56788: tcp 5840
12:06:20.423515 IP 192.168.1.16.56788 > 192.168.1.22.8000: tcp 0
12:06:20.423519 IP 192.168.1.22.8000 > 192.168.1.16.56788: tcp 5840
12:06:20.423526 IP 192.168.1.16.56788 > 192.168.1.22.8000: tcp 0
12:06:20.423530 IP 192.168.1.16.56788 > 192.168.1.22.8000: tcp 0
12:06:20.423531 IP 192.168.1.16.56788 > 192.168.1.22.8000: tcp 0
12:06:20.425374 IP 192.168.1.22.8000 > 192.168.1.16.56788: tcp 5840
12:06:20.425413 IP 192.168.1.22.8000 > 192.168.1.16.56788: tcp 7300
12:06:20.425446 IP 192.168.1.22.8000 > 192.168.1.16.56788: tcp 4380
12:06:20.427212 IP 192.168.1.16.56792 > 192.168.1.22.8000: tcp 0
12:06:20.427373 IP 192.168.1.16.56792 > 192.168.1.22.8000: tcp 983
12:06:20.427384 IP 192.168.1.22.8000 > 192.168.1.16.56792: tcp 0
12:06:20.427400 IP 192.168.1.16.56786 > 192.168.1.22.8000: tcp 0
12:06:20.427407 IP 192.168.1.22.8000 > 192.168.1.16.56786: tcp 5840
12:06:20.427416 IP 192.168.1.16.56786 > 192.168.1.22.8000: tcp 0
12:06:20.427420 IP 192.168.1.22.8000 > 192.168.1.16.56786: tcp 2920
12:06:20.427427 IP 192.168.1.22.8000 > 192.168.1.16.56786: tcp 2920
12:06:20.427880 IP 192.168.1.22.8000 > 192.168.1.16.56790: tcp 125
12:06:20.429186 IP 192.168.1.22.8000 > 192.168.1.16.56789: tcp 75
12:06:20.429253 IP 192.168.1.22.8000 > 192.168.1.16.56790: tcp 2920
12:06:20.429264 IP 192.168.1.22.8000 > 192.168.1.16.56790: tcp 2920
12:06:20.429270 IP 192.168.1.22.8000 > 192.168.1.16.56790: tcp 2920
12:06:20.429288 IP 192.168.1.22.8000 > 192.168.1.16.56791: tcp 125
12:06:20.429368 IP 192.168.1.22.8000 > 192.168.1.16.56791: tcp 2920
12:06:20.429376 IP 192.168.1.22.8000 > 192.168.1.16.56790: tcp 2920
12:06:20.429377 IP 192.168.1.22.8000 > 192.168.1.16.56790: tcp 1460
12:06:20.429430 IP 192.168.1.22.8000 > 192.168.1.16.56791: tcp 2920
12:06:20.429439 IP 192.168.1.22.8000 > 192.168.1.16.56791: tcp 2920
12:06:20.429458 IP 192.168.1.22.8000 > 192.168.1.16.56792: tcp 123
12:06:20.429490 IP 192.168.1.22.8000 > 192.168.1.16.56792: tcp 2920
12:06:20.434675 IP 192.168.1.16.56786 > 192.168.1.22.8000: tcp 0
12:06:20.434705 IP 192.168.1.16.56786 > 192.168.1.22.8000: tcp 0
12:06:20.434707 IP 192.168.1.16.56786 > 192.168.1.22.8000: tcp 0
12:06:20.434709 IP 192.168.1.16.56786 > 192.168.1.22.8000: tcp 0
12:06:20.434712 IP 192.168.1.16.56786 > 192.168.1.22.8000: tcp 0
12:06:20.434713 IP 192.168.1.16.56786 > 192.168.1.22.8000: tcp 0
12:06:20.434715 IP 192.168.1.16.56786 > 192.168.1.22.8000: tcp 0
12:06:20.439565 IP 192.168.1.16.56786 > 192.168.1.22.8000: tcp 0
12:06:20.439589 IP 192.168.1.16.56786 > 192.168.1.22.8000: tcp 0
12:06:20.439592 IP 192.168.1.16.56786 > 192.168.1.22.8000: tcp 0
12:06:20.439595 IP 192.168.1.16.56786 > 192.168.1.22.8000: tcp 0
12:06:20.439597 IP 192.168.1.16.56786 > 192.168.1.22.8000: tcp 0
12:06:20.439599 IP 192.168.1.16.56789 > 192.168.1.22.8000: tcp 0
12:06:20.439602 IP 192.168.1.16.56788 > 192.168.1.22.8000: tcp 0
12:06:20.448159 IP 192.168.1.16.56788 > 192.168.1.22.8000: tcp 0
12:06:20.448180 IP 192.168.1.16.56786 > 192.168.1.22.8000: tcp 0
12:06:20.448183 IP 192.168.1.16.56786 > 192.168.1.22.8000: tcp 0
12:06:20.448185 IP 192.168.1.16.56786 > 192.168.1.22.8000: tcp 0
12:06:20.448186 IP 192.168.1.16.56786 > 192.168.1.22.8000: tcp 0
12:06:20.448188 IP 192.168.1.16.56786 > 192.168.1.22.8000: tcp 0
12:06:20.448189 IP 192.168.1.16.56786 > 192.168.1.22.8000: tcp 0
12:06:20.448749 IP 192.168.1.16.56791 > 192.168.1.22.8000: tcp 0
12:06:20.448774 IP 192.168.1.22.8000 > 192.168.1.16.56791: tcp 2920
12:06:20.448827 IP 192.168.1.22.8000 > 192.168.1.16.56791: tcp 2920
12:06:20.448863 IP 192.168.1.16.56790 > 192.168.1.22.8000: tcp 0
12:06:20.448882 IP 192.168.1.22.8000 > 192.168.1.16.56790: tcp 2920
12:06:20.448978 IP 192.168.1.22.8000 > 192.168.1.16.56790: tcp 2920
12:06:20.449012 IP 192.168.1.16.56790 > 192.168.1.22.8000: tcp 0
12:06:20.453828 IP 192.168.1.16.56788 > 192.168.1.22.8000: tcp 0
12:06:20.453848 IP 192.168.1.16.56788 > 192.168.1.22.8000: tcp 0
12:06:20.453852 IP 192.168.1.16.56788 > 192.168.1.22.8000: tcp 0
12:06:20.453859 IP 192.168.1.16.56788 > 192.168.1.22.8000: tcp 0
12:06:20.453867 IP 192.168.1.22.8000 > 192.168.1.16.56788: tcp 0
12:06:20.453916 IP 192.168.1.22.8000 > 192.168.1.16.56790: tcp 2920
12:06:20.453944 IP 192.168.1.22.8000 > 192.168.1.16.56790: tcp 2920
12:06:20.454226 IP 192.168.1.22.8000 > 192.168.1.16.56791: tcp 2920
12:06:20.454269 IP 192.168.1.22.8000 > 192.168.1.16.56791: tcp 2920
12:06:20.454697 IP 192.168.1.16.56796 > 192.168.1.22.8000: tcp 0
12:06:20.454708 IP 192.168.1.22.8000 > 192.168.1.16.56796: tcp 0
12:06:20.454717 IP 192.168.1.16.56793 > 192.168.1.22.8000: tcp 0
12:06:20.454879 IP 192.168.1.16.56793 > 192.168.1.22.8000: tcp 994
12:06:20.454892 IP 192.168.1.22.8000 > 192.168.1.16.56793: tcp 0
12:06:20.454939 IP 192.168.1.16.56790 > 192.168.1.22.8000: tcp 0
12:06:20.454944 IP 192.168.1.22.8000 > 192.168.1.16.56790: tcp 1460
12:06:20.465409 IP 192.168.1.16.56795 > 192.168.1.22.8000: tcp 985
12:06:20.465435 IP 192.168.1.22.8000 > 192.168.1.16.56793: tcp 125
12:06:20.465449 IP 192.168.1.16.56790 > 192.168.1.22.8000: tcp 0
12:06:20.465456 IP 192.168.1.22.8000 > 192.168.1.16.56793: tcp 2920
12:06:20.465457 IP 192.168.1.22.8000 > 192.168.1.16.56793: tcp 2920
12:06:20.465458 IP 192.168.1.22.8000 > 192.168.1.16.56794: tcp 124
12:06:20.465459 IP 192.168.1.22.8000 > 192.168.1.16.56794: tcp 2920
12:06:20.465784 IP 192.168.1.22.8000 > 192.168.1.16.56790: tcp 7300
12:06:20.465887 IP 192.168.1.22.8000 > 192.168.1.16.56791: tcp 5840
12:06:20.465921 IP 192.168.1.22.8000 > 192.168.1.16.56795: tcp 123
12:06:20.465936 IP 192.168.1.22.8000 > 192.168.1.16.56796: tcp 124
12:06:20.465965 IP 192.168.1.22.8000 > 192.168.1.16.56795: tcp 5840
12:06:20.465980 IP 192.168.1.22.8000 > 192.168.1.16.56796: tcp 2920
12:06:20.465994 IP 192.168.1.22.8000 > 192.168.1.16.56796: tcp 2920
12:06:20.466140 IP 192.168.1.22.8000 > 192.168.1.16.56795: tcp 61
12:06:20.466145 IP 192.168.1.22.8000 > 192.168.1.16.56791: tcp 4380
12:06:20.466168 IP 192.168.1.22.8000 > 192.168.1.16.56791: tcp 8760
12:06:20.466380 IP 192.168.1.22.8000 > 192.168.1.16.56790: tcp 4380
12:06:20.466422 IP 192.168.1.22.8000 > 192.168.1.16.56790: tcp 7300
12:06:20.466489 IP 192.168.1.22.8000 > 192.168.1.16.56796: tcp 1460
12:06:20.466545 IP 192.168.1.22.8000 > 192.168.1.16.56796: tcp 1215
12:06:20.472770 IP 192.168.1.16.56790 > 192.168.1.22.8000: tcp 0
12:06:20.472792 IP 192.168.1.22.8000 > 192.168.1.16.56790: tcp 4216
12:06:20.472815 IP 192.168.1.16.56790 > 192.168.1.22.8000: tcp 0
12:06:20.472817 IP 192.168.1.16.56791 > 192.168.1.22.8000: tcp 0
12:06:20.472822 IP 192.168.1.22.8000 > 192.168.1.16.56791: tcp 8760
12:06:20.472865 IP 192.168.1.22.8000 > 192.168.1.16.56791: tcp 4380
12:06:20.472872 IP 192.168.1.16.56791 > 192.168.1.22.8000: tcp 0
12:06:20.476885 IP 192.168.1.22.8000 > 192.168.1.16.56795: tcp 61
12:06:20.478592 IP 192.168.1.16.56793 > 192.168.1.22.8000: tcp 0
12:06:20.478633 IP 192.168.1.22.8000 > 192.168.1.16.56793: tcp 2920
12:06:20.478647 IP 192.168.1.22.8000 > 192.168.1.16.56793: tcp 2920
12:06:20.478676 IP 192.168.1.16.56793 > 192.168.1.22.8000: tcp 0
12:06:20.478707 IP 192.168.1.16.56794 > 192.168.1.22.8000: tcp 0
12:06:20.478710 IP 192.168.1.22.8000 > 192.168.1.16.56794: tcp 2920
12:06:20.478721 IP 192.168.1.22.8000 > 192.168.1.16.56794: tcp 2920
12:06:20.478740 IP 192.168.1.16.56794 > 192.168.1.22.8000: tcp 0
12:06:20.478770 IP 192.168.1.16.56790 > 192.168.1.22.8000: tcp 0
12:06:20.478783 IP 192.168.1.22.8000 > 192.168.1.16.56790: tcp 2920
12:06:20.478800 IP 192.168.1.16.56790 > 192.168.1.22.8000: tcp 0
12:06:20.478801 IP 192.168.1.16.56790 > 192.168.1.22.8000: tcp 0
12:06:20.478803 IP 192.168.1.22.8000 > 192.168.1.16.56790: tcp 5840
12:06:20.478808 IP 192.168.1.16.56790 > 192.168.1.22.8000: tcp 0
12:06:20.478817 IP 192.168.1.16.56790 > 192.168.1.22.8000: tcp 0
12:06:20.478826 IP 192.168.1.22.8000 > 192.168.1.16.56790: tcp 7300
12:06:20.478832 IP 192.168.1.16.56790 > 192.168.1.22.8000: tcp 0
12:06:20.478834 IP 192.168.1.16.56790 > 192.168.1.22.8000: tcp 0
12:06:20.478835 IP 192.168.1.16.56790 > 192.168.1.22.8000: tcp 0
12:06:20.478836 IP 192.168.1.16.56790 > 192.168.1.22.8000: tcp 0
12:06:20.478838 IP 192.168.1.16.56791 > 192.168.1.22.8000: tcp 0
12:06:20.478923 IP 192.168.1.22.8000 > 192.168.1.16.56790: tcp 1460
12:06:20.478956 IP 192.168.1.22.8000 > 192.168.1.16.56790: tcp 164
12:06:20.478964 IP 192.168.1.22.8000 > 192.168.1.16.56790: tcp 7300
12:06:20.478970 IP 192.168.1.22.8000 > 192.168.1.16.56794: tcp 2920
12:06:20.478974 IP 192.168.1.22.8000 > 192.168.1.16.56794: tcp 2920
12:06:20.479008 IP 192.168.1.22.8000 > 192.168.1.16.56793: tcp 2920
12:06:20.479036 IP 192.168.1.22.8000 > 192.168.1.16.56793: tcp 2920
12:06:20.479087 IP 192.168.1.22.8000 > 192.168.1.16.56794: tcp 897
12:06:20.489128 IP 192.168.1.22.8000 > 192.168.1.16.56796: tcp 1215
12:06:20.497477 IP 192.168.1.16.56791 > 192.168.1.22.8000: tcp 0
12:06:20.497525 IP 192.168.1.22.8000 > 192.168.1.16.56791: tcp 4380
12:06:20.497545 IP 192.168.1.16.56791 > 192.168.1.22.8000: tcp 0
12:06:20.497551 IP 192.168.1.16.56791 > 192.168.1.22.8000: tcp 0
12:06:20.497563 IP 192.168.1.22.8000 > 192.168.1.16.56791: tcp 4380
12:06:20.497578 IP 192.168.1.16.56791 > 192.168.1.22.8000: tcp 0
12:06:20.497580 IP 192.168.1.16.56794 > 192.168.1.22.8000: tcp 0
12:06:20.497617 IP 192.168.1.16.56793 > 192.168.1.22.8000: tcp 0
12:06:20.497651 IP 192.168.1.22.8000 > 192.168.1.16.56793: tcp 2582
12:06:20.497667 IP 192.168.1.16.56793 > 192.168.1.22.8000: tcp 0
12:06:20.497696 IP 192.168.1.16.56790 > 192.168.1.22.8000: tcp 0
12:06:20.497705 IP 192.168.1.22.8000 > 192.168.1.16.56790: tcp 5840
12:06:20.499012 IP 192.168.1.16.56790 > 192.168.1.22.8000: tcp 0
12:06:20.499041 IP 192.168.1.16.56791 > 192.168.1.22.8000: tcp 0
12:06:20.499046 IP 192.168.1.22.8000 > 192.168.1.16.56791: tcp 2920
12:06:20.499112 IP 192.168.1.22.8000 > 192.168.1.16.56791: tcp 2920
12:06:20.499155 IP 192.168.1.16.56791 > 192.168.1.22.8000: tcp 0
12:06:20.499169 IP 192.168.1.16.56795 > 192.168.1.22.8000: tcp 0
12:06:20.499172 IP 192.168.1.16.56795 > 192.168.1.22.8000: tcp 0
12:06:20.499174 IP 192.168.1.16.56796 > 192.168.1.22.8000: tcp 0
12:06:20.499176 IP 192.168.1.16.56796 > 192.168.1.22.8000: tcp 0
12:06:20.499179 IP 192.168.1.16.56795 > 192.168.1.22.8000: tcp 0
12:06:20.499187 IP 192.168.1.16.56795 > 192.168.1.22.8000: tcp 0
12:06:20.499230 IP 192.168.1.16.56797 > 192.168.1.22.8000: tcp 0
12:06:20.499248 IP 192.168.1.22.8000 > 192.168.1.16.56797: tcp 0
12:06:20.499281 IP 192.168.1.16.56791 > 192.168.1.22.8000: tcp 0
12:06:20.499284 IP 192.168.1.16.56791 > 192.168.1.22.8000: tcp 0
12:06:20.499286 IP 192.168.1.16.56791 > 192.168.1.22.8000: tcp 0
12:06:20.499288 IP 192.168.1.16.56791 > 192.168.1.22.8000: tcp 0
12:06:20.499290 IP 192.168.1.16.56791 > 192.168.1.22.8000: tcp 0
12:06:20.499973 IP 192.168.1.22.8000 > 192.168.1.16.56791: tcp 2920
12:06:20.500055 IP 192.168.1.22.8000 > 192.168.1.16.56791: tcp 2920
12:06:20.500094 IP 192.168.1.22.8000 > 192.168.1.16.56791: tcp 2920
12:06:20.500101 IP 192.168.1.22.8000 > 192.168.1.16.56791: tcp 2920
12:06:20.500107 IP 192.168.1.22.8000 > 192.168.1.16.56791: tcp 2920
12:06:20.500180 IP 192.168.1.22.8000 > 192.168.1.16.56791: tcp 2920
12:06:20.500254 IP 192.168.1.22.8000 > 192.168.1.16.56791: tcp 2920
12:06:20.500260 IP 192.168.1.22.8000 > 192.168.1.16.56791: tcp 2756
12:06:20.504119 IP 192.168.1.16.56791 > 192.168.1.22.8000: tcp 0
12:06:20.504157 IP 192.168.1.22.8000 > 192.168.1.16.56791: tcp 2920
12:06:20.504179 IP 192.168.1.16.56790 > 192.168.1.22.8000: tcp 0
12:06:20.504186 IP 192.168.1.22.8000 > 192.168.1.16.56790: tcp 4380
12:06:20.504195 IP 192.168.1.16.56790 > 192.168.1.22.8000: tcp 0
12:06:20.504198 IP 192.168.1.22.8000 > 192.168.1.16.56790: tcp 4380
12:06:20.504204 IP 192.168.1.16.56790 > 192.168.1.22.8000: tcp 0
12:06:20.504229 IP 192.168.1.16.56790 > 192.168.1.22.8000: tcp 0
12:06:20.504233 IP 192.168.1.16.56796 > 192.168.1.22.8000: tcp 0
12:06:20.504354 IP 192.168.1.22.8000 > 192.168.1.16.56790: tcp 2920
12:06:20.504396 IP 192.168.1.22.8000 > 192.168.1.16.56790: tcp 2920
12:06:20.504423 IP 192.168.1.22.8000 > 192.168.1.16.56790: tcp 2920
12:06:20.504511 IP 192.168.1.22.8000 > 192.168.1.16.56790: tcp 1460
12:06:20.504555 IP 192.168.1.22.8000 > 192.168.1.16.56790: tcp 2920
12:06:20.504562 IP 192.168.1.22.8000 > 192.168.1.16.56790: tcp 2920
12:06:20.507600 IP 192.168.1.16.56796 > 192.168.1.22.8000: tcp 0
12:06:20.507621 IP 192.168.1.22.8000 > 192.168.1.16.56796: tcp 0
12:06:20.507655 IP 192.168.1.16.56798 > 192.168.1.22.8000: tcp 0
12:06:20.507665 IP 192.168.1.22.8000 > 192.168.1.16.56798: tcp 0
12:06:20.507699 IP 192.168.1.16.56790 > 192.168.1.22.8000: tcp 0
12:06:20.507708 IP 192.168.1.22.8000 > 192.168.1.16.56790: tcp 2920
12:06:20.507759 IP 192.168.1.16.56791 > 192.168.1.22.8000: tcp 0
12:06:20.507774 IP 192.168.1.22.8000 > 192.168.1.16.56791: tcp 1460
12:06:20.507807 IP 192.168.1.22.8000 > 192.168.1.16.56791: tcp 1072
12:06:20.507842 IP 192.168.1.16.56791 > 192.168.1.22.8000: tcp 0
12:06:20.507856 IP 192.168.1.16.56791 > 192.168.1.22.8000: tcp 0
12:06:20.507858 IP 192.168.1.16.56791 > 192.168.1.22.8000: tcp 0
12:06:20.507860 IP 192.168.1.16.56791 > 192.168.1.22.8000: tcp 0
12:06:20.507862 IP 192.168.1.16.56790 > 192.168.1.22.8000: tcp 0
12:06:20.507865 IP 192.168.1.22.8000 > 192.168.1.16.56790: tcp 2920
12:06:20.507912 IP 192.168.1.16.56791 > 192.168.1.22.8000: tcp 0
12:06:20.507916 IP 192.168.1.16.56795 > 192.168.1.22.8000: tcp 0
12:06:20.529456 IP 192.168.1.16.56790 > 192.168.1.22.8000: tcp 0
12:06:20.529501 IP 192.168.1.22.8000 > 192.168.1.16.56790: tcp 2920
12:06:20.529517 IP 192.168.1.16.56790 > 192.168.1.22.8000: tcp 0
12:06:20.529520 IP 192.168.1.22.8000 > 192.168.1.16.56790: tcp 2920
12:06:20.529526 IP 192.168.1.16.56790 > 192.168.1.22.8000: tcp 0
12:06:20.529541 IP 192.168.1.16.56790 > 192.168.1.22.8000: tcp 0
12:06:20.529542 IP 192.168.1.16.56790 > 192.168.1.22.8000: tcp 0
12:06:20.529555 IP 192.168.1.16.56794 > 192.168.1.22.8000: tcp 0
12:06:20.529559 IP 192.168.1.16.56793 > 192.168.1.22.8000: tcp 0
12:06:20.529560 IP 192.168.1.16.56794 > 192.168.1.22.8000: tcp 0
12:06:20.529611 IP 192.168.1.22.8000 > 192.168.1.16.56790: tcp 2920
12:06:20.529644 IP 192.168.1.22.8000 > 192.168.1.16.56790: tcp 2920
12:06:20.529653 IP 192.168.1.22.8000 > 192.168.1.16.56790: tcp 2920
12:06:20.529708 IP 192.168.1.22.8000 > 192.168.1.16.56790: tcp 2920
12:06:20.529740 IP 192.168.1.22.8000 > 192.168.1.16.56790: tcp 2920
12:06:20.529763 IP 192.168.1.22.8000 > 192.168.1.16.56790: tcp 2920
12:06:20.529810 IP 192.168.1.22.8000 > 192.168.1.16.56790: tcp 2920
12:06:20.543287 IP 192.168.1.16.56796 > 192.168.1.22.8000: tcp 0
12:06:20.543315 IP 192.168.1.16.56794 > 192.168.1.22.8000: tcp 0
12:06:20.543321 IP 192.168.1.22.8000 > 192.168.1.16.56794: tcp 0
12:06:20.543332 IP 192.168.1.16.56799 > 192.168.1.22.8000: tcp 0
12:06:20.543341 IP 192.168.1.22.8000 > 192.168.1.16.56799: tcp 0
12:06:20.543348 IP 192.168.1.16.56791 > 192.168.1.22.8000: tcp 0
12:06:20.543352 IP 192.168.1.16.56791 > 192.168.1.22.8000: tcp 0
12:06:20.543378 IP 192.168.1.16.56793 > 192.168.1.22.8000: tcp 0
12:06:20.543381 IP 192.168.1.22.8000 > 192.168.1.16.56793: tcp 0
12:06:20.543387 IP 192.168.1.16.56800 > 192.168.1.22.8000: tcp 0
12:06:20.543411 IP 192.168.1.22.8000 > 192.168.1.16.56800: tcp 0
12:06:20.543420 IP 192.168.1.16.56790 > 192.168.1.22.8000: tcp 0
12:06:20.543426 IP 192.168.1.22.8000 > 192.168.1.16.56790: tcp 2920
12:06:20.543446 IP 192.168.1.16.56790 > 192.168.1.22.8000: tcp 0
12:06:20.543449 IP 192.168.1.22.8000 > 192.168.1.16.56790: tcp 2920
12:06:20.543455 IP 192.168.1.16.56791 > 192.168.1.22.8000: tcp 0
12:06:20.543875 IP 192.168.1.22.8000 > 192.168.1.16.56790: tcp 2920
12:06:20.543913 IP 192.168.1.22.8000 > 192.168.1.16.56790: tcp 2920
12:06:20.543920 IP 192.168.1.22.8000 > 192.168.1.16.56797: tcp 130
12:06:20.543933 IP 192.168.1.22.8000 > 192.168.1.16.56790: tcp 2920
12:06:20.544039 IP 192.168.1.22.8000 > 192.168.1.16.56790: tcp 2920
12:06:20.544078 IP 192.168.1.22.8000 > 192.168.1.16.56790: tcp 2920
12:06:20.544096 IP 192.168.1.22.8000 > 192.168.1.16.56790: tcp 2920
12:06:20.550959 IP 192.168.1.16.56790 > 192.168.1.22.8000: tcp 0
12:06:20.550983 IP 192.168.1.22.8000 > 192.168.1.16.56790: tcp 2920
12:06:20.559621 IP 192.168.1.16.56798 > 192.168.1.22.8000: tcp 0
12:06:20.568152 IP 192.168.1.16.56798 > 192.168.1.22.8000: tcp 982
12:06:20.568173 IP 192.168.1.22.8000 > 192.168.1.16.56798: tcp 0
12:06:20.568188 IP 192.168.1.16.56790 > 192.168.1.22.8000: tcp 0
12:06:20.568194 IP 192.168.1.22.8000 > 192.168.1.16.56790: tcp 2920
12:06:20.568216 IP 192.168.1.16.56791 > 192.168.1.22.8000: tcp 0
12:06:20.568220 IP 192.168.1.16.56791 > 192.168.1.22.8000: tcp 0
12:06:20.568228 IP 192.168.1.16.56791 > 192.168.1.22.8000: tcp 0
12:06:20.568632 IP 192.168.1.22.8000 > 192.168.1.16.56798: tcp 353
12:06:20.623364 IP 192.168.1.16.56790 > 192.168.1.22.8000: tcp 0
12:06:20.623399 IP 192.168.1.22.8000 > 192.168.1.16.56790: tcp 2920
12:06:20.627006 IP 192.168.1.16.56790 > 192.168.1.22.8000: tcp 0
12:06:20.627066 IP 192.168.1.22.8000 > 192.168.1.16.56790: tcp 2920
12:06:20.627113 IP 192.168.1.16.56790 > 192.168.1.22.8000: tcp 0
12:06:20.627129 IP 192.168.1.22.8000 > 192.168.1.16.56790: tcp 2920
12:06:20.627137 IP 192.168.1.16.56790 > 192.168.1.22.8000: tcp 0
12:06:20.627166 IP 192.168.1.16.56790 > 192.168.1.22.8000: tcp 0
12:06:20.627182 IP 192.168.1.16.56790 > 192.168.1.22.8000: tcp 0
12:06:20.627198 IP 192.168.1.16.56790 > 192.168.1.22.8000: tcp 0
12:06:20.627210 IP 192.168.1.16.56790 > 192.168.1.22.8000: tcp 0
12:06:20.627213 IP 192.168.1.16.56799 > 192.168.1.22.8000: tcp 0
12:06:20.627225 IP 192.168.1.16.56799 > 192.168.1.22.8000: tcp 992
12:06:20.627228 IP 192.168.1.22.8000 > 192.168.1.16.56799: tcp 0
12:06:20.627237 IP 192.168.1.16.56790 > 192.168.1.22.8000: tcp 0
12:06:20.627249 IP 192.168.1.16.56800 > 192.168.1.22.8000: tcp 0
12:06:20.627254 IP 192.168.1.16.56790 > 192.168.1.22.8000: tcp 0
12:06:20.627941 IP 192.168.1.22.8000 > 192.168.1.16.56799: tcp 2920
12:06:20.628005 IP 192.168.1.22.8000 > 192.168.1.16.56799: tcp 2920
12:06:20.628022 IP 192.168.1.22.8000 > 192.168.1.16.56799: tcp 1460
12:06:20.628869 IP 192.168.1.16.56790 > 192.168.1.22.8000: tcp 0
12:06:20.628894 IP 192.168.1.22.8000 > 192.168.1.16.56790: tcp 2920
12:06:20.628907 IP 192.168.1.16.56790 > 192.168.1.22.8000: tcp 0
12:06:20.628909 IP 192.168.1.22.8000 > 192.168.1.16.56790: tcp 2920
12:06:20.628917 IP 192.168.1.16.56790 > 192.168.1.22.8000: tcp 0
12:06:20.628919 IP 192.168.1.16.56797 > 192.168.1.22.8000: tcp 0
12:06:20.628960 IP 192.168.1.16.56790 > 192.168.1.22.8000: tcp 0
12:06:20.628970 IP 192.168.1.16.56797 > 192.168.1.22.8000: tcp 0
12:06:20.629003 IP 192.168.1.22.8000 > 192.168.1.16.56797: tcp 0
12:06:20.629012 IP 192.168.1.16.56802 > 192.168.1.22.8000: tcp 0
12:06:20.629025 IP 192.168.1.22.8000 > 192.168.1.16.56802: tcp 0
12:06:20.629029 IP 192.168.1.16.56790 > 192.168.1.22.8000: tcp 0
12:06:20.629030 IP 192.168.1.16.56790 > 192.168.1.22.8000: tcp 0
12:06:20.629032 IP 192.168.1.16.56790 > 192.168.1.22.8000: tcp 0
12:06:20.629041 IP 192.168.1.16.56790 > 192.168.1.22.8000: tcp 0
12:06:20.629312 IP 192.168.1.22.8000 > 192.168.1.16.56790: tcp 2920
12:06:20.629354 IP 192.168.1.22.8000 > 192.168.1.16.56790: tcp 2920
12:06:20.629366 IP 192.168.1.22.8000 > 192.168.1.16.56790: tcp 2920
12:06:20.629570 IP 192.168.1.22.8000 > 192.168.1.16.56790: tcp 2920
12:06:20.629593 IP 192.168.1.22.8000 > 192.168.1.16.56790: tcp 2920
12:06:20.629621 IP 192.168.1.22.8000 > 192.168.1.16.56790: tcp 2920
12:06:20.633339 IP 192.168.1.16.56790 > 192.168.1.22.8000: tcp 0
12:06:20.633364 IP 192.168.1.22.8000 > 192.168.1.16.56790: tcp 2920
12:06:20.641386 IP 192.168.1.16.56801 > 192.168.1.22.8000: tcp 0
12:06:20.641610 IP 192.168.1.16.56801 > 192.168.1.22.8000: tcp 992
12:06:20.641626 IP 192.168.1.22.8000 > 192.168.1.16.56801: tcp 0
12:06:20.641652 IP 192.168.1.16.56790 > 192.168.1.22.8000: tcp 0
12:06:20.641658 IP 192.168.1.22.8000 > 192.168.1.16.56790: tcp 2920
12:06:20.641666 IP 192.168.1.16.56790 > 192.168.1.22.8000: tcp 0
12:06:20.641670 IP 192.168.1.22.8000 > 192.168.1.16.56790: tcp 2920
12:06:20.641676 IP 192.168.1.16.56798 > 192.168.1.22.8000: tcp 0
12:06:20.647336 IP 192.168.1.16.56790 > 192.168.1.22.8000: tcp 0
12:06:20.647363 IP 192.168.1.22.8000 > 192.168.1.16.56790: tcp 2920
12:06:20.647378 IP 192.168.1.16.56790 > 192.168.1.22.8000: tcp 0
12:06:20.647401 IP 192.168.1.22.8000 > 192.168.1.16.56790: tcp 2920
12:06:20.647408 IP 192.168.1.16.56790 > 192.168.1.22.8000: tcp 0
12:06:20.647423 IP 192.168.1.16.56790 > 192.168.1.22.8000: tcp 0
12:06:20.647438 IP 192.168.1.16.56790 > 192.168.1.22.8000: tcp 0
12:06:20.647441 IP 192.168.1.16.56790 > 192.168.1.22.8000: tcp 0
12:06:20.647452 IP 192.168.1.16.56790 > 192.168.1.22.8000: tcp 0
12:06:20.647460 IP 192.168.1.16.56790 > 192.168.1.22.8000: tcp 0
12:06:20.647462 IP 192.168.1.16.56799 > 192.168.1.22.8000: tcp 0
12:06:20.647480 IP 192.168.1.22.8000 > 192.168.1.16.56799: tcp 2920
12:06:20.647498 IP 192.168.1.22.8000 > 192.168.1.16.56799: tcp 2920
12:06:20.647514 IP 192.168.1.16.56799 > 192.168.1.22.8000: tcp 0
12:06:20.647552 IP 192.168.1.16.56800 > 192.168.1.22.8000: tcp 0
12:06:20.647575 IP 192.168.1.16.56799 > 192.168.1.22.8000: tcp 0
12:06:20.647586 IP 192.168.1.16.56800 > 192.168.1.22.8000: tcp 0
12:06:20.647600 IP 192.168.1.22.8000 > 192.168.1.16.56800: tcp 0
12:06:20.647608 IP 192.168.1.16.56799 > 192.168.1.22.8000: tcp 0
12:06:20.647625 IP 192.168.1.16.56804 > 192.168.1.22.8000: tcp 0
12:06:20.647853 IP 192.168.1.16.56802 > 192.168.1.22.8000: tcp 986
12:06:20.647880 IP 192.168.1.22.8000 > 192.168.1.16.56802: tcp 0
12:06:20.647889 IP 192.168.1.16.56790 > 192.168.1.22.8000: tcp 0
12:06:20.647892 IP 192.168.1.22.8000 > 192.168.1.16.56790: tcp 2920
12:06:20.647897 IP 192.168.1.22.8000 > 192.168.1.16.56790: tcp 2920
12:06:20.647902 IP 192.168.1.16.56790 > 192.168.1.22.8000: tcp 0
12:06:20.647927 IP 192.168.1.16.56790 > 192.168.1.22.8000: tcp 0
12:06:20.648423 IP 192.168.1.22.8000 > 192.168.1.16.56802: tcp 2920
12:06:20.648470 IP 192.168.1.22.8000 > 192.168.1.16.56802: tcp 834
12:06:20.648485 IP 192.168.1.22.8000 > 192.168.1.16.56799: tcp 2920
12:06:20.648505 IP 192.168.1.22.8000 > 192.168.1.16.56799: tcp 1460
12:06:20.648511 IP 192.168.1.22.8000 > 192.168.1.16.56790: tcp 5840
12:06:20.648528 IP 192.168.1.22.8000 > 192.168.1.16.56790: tcp 5840
12:06:20.648539 IP 192.168.1.22.8000 > 192.168.1.16.56799: tcp 1460
12:06:20.652782 IP 192.168.1.16.56790 > 192.168.1.22.8000: tcp 0
12:06:20.652827 IP 192.168.1.22.8000 > 192.168.1.16.56790: tcp 2920
12:06:20.652840 IP 192.168.1.16.56790 > 192.168.1.22.8000: tcp 0
12:06:20.652868 IP 192.168.1.22.8000 > 192.168.1.16.56790: tcp 2920
12:06:20.652874 IP 192.168.1.16.56801 > 192.168.1.22.8000: tcp 0
12:06:20.652901 IP 192.168.1.16.56801 > 192.168.1.22.8000: tcp 0
12:06:20.652917 IP 192.168.1.22.8000 > 192.168.1.16.56801: tcp 0
12:06:20.656573 IP 192.168.1.16.56790 > 192.168.1.22.8000: tcp 0
12:06:20.656610 IP 192.168.1.22.8000 > 192.168.1.16.56790: tcp 2920
12:06:20.656627 IP 192.168.1.16.56790 > 192.168.1.22.8000: tcp 0
12:06:20.656630 IP 192.168.1.16.56799 > 192.168.1.22.8000: tcp 0
12:06:20.656672 IP 192.168.1.22.8000 > 192.168.1.16.56799: tcp 2920
12:06:20.656679 IP 192.168.1.22.8000 > 192.168.1.16.56799: tcp 2920
12:06:20.656998 IP 192.168.1.16.56804 > 192.168.1.22.8000: tcp 0
12:06:20.657572 IP 192.168.1.22.8000 > 192.168.1.16.56804: tcp 2920
12:06:20.657621 IP 192.168.1.22.8000 > 192.168.1.16.56804: tcp 1460
12:06:20.675253 IP 192.168.1.16.56790 > 192.168.1.22.8000: tcp 0
12:06:20.675282 IP 192.168.1.22.8000 > 192.168.1.16.56790: tcp 164
12:06:20.675311 IP 192.168.1.16.56799 > 192.168.1.22.8000: tcp 0
12:06:20.675320 IP 192.168.1.22.8000 > 192.168.1.16.56799: tcp 2920
12:06:20.675329 IP 192.168.1.22.8000 > 192.168.1.16.56799: tcp 2920
12:06:20.675335 IP 192.168.1.16.56799 > 192.168.1.22.8000: tcp 0
12:06:20.675338 IP 192.168.1.16.56799 > 192.168.1.22.8000: tcp 0
12:06:20.675523 IP 192.168.1.22.8000 > 192.168.1.16.56799: tcp 2920
12:06:20.675566 IP 192.168.1.22.8000 > 192.168.1.16.56799: tcp 2920
12:06:20.675582 IP 192.168.1.22.8000 > 192.168.1.16.56790: tcp 4380
12:06:20.675596 IP 192.168.1.22.8000 > 192.168.1.16.56799: tcp 2920
12:06:20.675613 IP 192.168.1.22.8000 > 192.168.1.16.56799: tcp 2920
12:06:20.675660 IP 192.168.1.22.8000 > 192.168.1.16.56799: tcp 1460
12:06:20.675696 IP 192.168.1.22.8000 > 192.168.1.16.56799: tcp 2920
12:06:20.675707 IP 192.168.1.16.56799 > 192.168.1.22.8000: tcp 0
12:06:20.675712 IP 192.168.1.22.8000 > 192.168.1.16.56799: tcp 2920
12:06:20.675719 IP 192.168.1.22.8000 > 192.168.1.16.56799: tcp 2920
12:06:20.675726 IP 192.168.1.16.56799 > 192.168.1.22.8000: tcp 0
12:06:20.675729 IP 192.168.1.16.56790 > 192.168.1.22.8000: tcp 0
12:06:20.676019 IP 192.168.1.22.8000 > 192.168.1.16.56799: tcp 2920
12:06:20.676054 IP 192.168.1.22.8000 > 192.168.1.16.56799: tcp 2920
12:06:20.676114 IP 192.168.1.16.56790 > 192.168.1.22.8000: tcp 0
12:06:20.676119 IP 192.168.1.22.8000 > 192.168.1.16.56790: tcp 2920
12:06:20.676129 IP 192.168.1.16.56790 > 192.168.1.22.8000: tcp 0
12:06:20.676132 IP 192.168.1.22.8000 > 192.168.1.16.56790: tcp 2920
12:06:20.676138 IP 192.168.1.16.56799 > 192.168.1.22.8000: tcp 0
12:06:20.676142 IP 192.168.1.22.8000 > 192.168.1.16.56799: tcp 2920
12:06:20.676148 IP 192.168.1.22.8000 > 192.168.1.16.56799: tcp 2920
12:06:20.676247 IP 192.168.1.22.8000 > 192.168.1.16.56790: tcp 1460
12:06:20.676284 IP 192.168.1.22.8000 > 192.168.1.16.56790: tcp 2920
12:06:20.676291 IP 192.168.1.22.8000 > 192.168.1.16.56790: tcp 2920
12:06:20.676301 IP 192.168.1.16.56805 > 192.168.1.22.8000: tcp 983
12:06:20.676313 IP 192.168.1.22.8000 > 192.168.1.16.56805: tcp 0
12:06:20.676317 IP 192.168.1.16.56790 > 192.168.1.22.8000: tcp 0
12:06:20.676319 IP 192.168.1.22.8000 > 192.168.1.16.56790: tcp 2920
12:06:20.676324 IP 192.168.1.22.8000 > 192.168.1.16.56790: tcp 2920
12:06:20.676328 IP 192.168.1.16.56799 > 192.168.1.22.8000: tcp 0
12:06:20.676330 IP 192.168.1.22.8000 > 192.168.1.16.56799: tcp 2920
12:06:20.676334 IP 192.168.1.22.8000 > 192.168.1.16.56799: tcp 2920
12:06:20.676890 IP 192.168.1.22.8000 > 192.168.1.16.56804: tcp 1460
12:06:20.713220 IP 192.168.1.22.8000 > 192.168.1.16.56805: tcp 801
12:06:20.736822 IP 192.168.1.22.8000 > 192.168.1.16.56799: tcp 1460
12:06:20.825105 IP 192.168.1.16.56790 > 192.168.1.22.8000: tcp 0
12:06:20.825170 IP 192.168.1.22.8000 > 192.168.1.16.56790: tcp 2920
12:06:20.825198 IP 192.168.1.16.56790 > 192.168.1.22.8000: tcp 0
12:06:20.825225 IP 192.168.1.22.8000 > 192.168.1.16.56790: tcp 2920
12:06:20.825247 IP 192.168.1.16.56790 > 192.168.1.22.8000: tcp 0
12:06:20.825270 IP 192.168.1.16.56799 > 192.168.1.22.8000: tcp 0
12:06:20.825311 IP 192.168.1.22.8000 > 192.168.1.16.56799: tcp 2920
12:06:20.825412 IP 192.168.1.22.8000 > 192.168.1.16.56799: tcp 2920
12:06:20.825484 IP 192.168.1.16.56804 > 192.168.1.22.8000: tcp 0
12:06:20.825496 IP 192.168.1.22.8000 > 192.168.1.16.56804: tcp 2920
12:06:20.825513 IP 192.168.1.22.8000 > 192.168.1.16.56804: tcp 1460
12:06:20.825565 IP 192.168.1.16.56804 > 192.168.1.22.8000: tcp 0
12:06:20.825634 IP 192.168.1.22.8000 > 192.168.1.16.56804: tcp 2920
12:06:20.825651 IP 192.168.1.16.56804 > 192.168.1.22.8000: tcp 0
12:06:20.825698 IP 192.168.1.16.56804 > 192.168.1.22.8000: tcp 0
12:06:20.825739 IP 192.168.1.16.56804 > 192.168.1.22.8000: tcp 0
12:06:20.825778 IP 192.168.1.16.56799 > 192.168.1.22.8000: tcp 0
12:06:20.825817 IP 192.168.1.16.56799 > 192.168.1.22.8000: tcp 0
12:06:20.825858 IP 192.168.1.16.56790 > 192.168.1.22.8000: tcp 0
12:06:20.825883 IP 192.168.1.16.56790 > 192.168.1.22.8000: tcp 0
12:06:20.825909 IP 192.168.1.16.56790 > 192.168.1.22.8000: tcp 0
12:06:20.825945 IP 192.168.1.16.56799 > 192.168.1.22.8000: tcp 0
12:06:20.826001 IP 192.168.1.16.56799 > 192.168.1.22.8000: tcp 0
12:06:20.826043 IP 192.168.1.16.56790 > 192.168.1.22.8000: tcp 0
12:06:20.826063 IP 192.168.1.16.56790 > 192.168.1.22.8000: tcp 0
12:06:20.826084 IP 192.168.1.16.56799 > 192.168.1.22.8000: tcp 0
12:06:20.826125 IP 192.168.1.16.56799 > 192.168.1.22.8000: tcp 0
