12:37:08.943513 IP 192.168.43.213.49834 > 192.168.43.118.800: tcp 0
12:37:08.943558 IP 192.168.43.118.800 > 192.168.43.213.49834: tcp 0
12:37:09.194520 IP 192.168.43.213.49835 > 192.168.43.118.800: tcp 0
12:37:09.194570 IP 192.168.43.118.800 > 192.168.43.213.49835: tcp 0
12:37:09.445766 IP 192.168.43.213.49834 > 192.168.43.118.800: tcp 0
12:37:09.445808 IP 192.168.43.118.800 > 192.168.43.213.49834: tcp 0
12:37:09.696773 IP 192.168.43.213.49835 > 192.168.43.118.800: tcp 0
12:37:11.950040 IP 192.168.43.213.49833 > 192.168.43.118.800: tcp 0
12:37:11.950135 IP 192.168.43.118.800 > 192.168.43.213.49833: tcp 0
12:37:12.451271 IP 192.168.43.213.49833 > 192.168.43.118.800: tcp 0
12:37:12.451365 IP 192.168.43.118.800 > 192.168.43.213.49833: tcp 0
12:37:17.462053 IP 192.168.43.213.49838 > 192.168.43.118.800: tcp 0
12:37:17.462148 IP 192.168.43.118.800 > 192.168.43.213.49838: tcp 0
12:37:17.713457 IP 192.168.43.213.49839 > 192.168.43.118.800: tcp 0
12:37:17.713509 IP 192.168.43.118.800 > 192.168.43.213.49839: tcp 0
12:37:17.964923 IP 192.168.43.213.49838 > 192.168.43.118.800: tcp 0
12:37:17.964978 IP 192.168.43.118.800 > 192.168.43.213.49838: tcp 0
12:37:17.975518 IP 192.168.43.213.49840 > 192.168.43.118.8000: tcp 0
12:37:17.975559 IP 192.168.43.118.8000 > 192.168.43.213.49840: tcp 0
12:37:17.975776 IP 192.168.43.213.49840 > 192.168.43.118.8000: tcp 0
12:37:17.976352 IP 192.168.43.213.49841 > 192.168.43.118.8000: tcp 0
12:37:17.976379 IP 192.168.43.118.8000 > 192.168.43.213.49841: tcp 0
12:37:17.976620 IP 192.168.43.213.49841 > 192.168.43.118.8000: tcp 0
12:37:17.983485 IP 192.168.43.213.49840 > 192.168.43.118.8000: tcp 386
12:37:17.983539 IP 192.168.43.118.8000 > 192.168.43.213.49840: tcp 0
12:37:18.210868 IP 192.168.43.213.49839 > 192.168.43.118.800: tcp 0
12:37:18.210925 IP 192.168.43.118.800 > 192.168.43.213.49839: tcp 0
12:37:18.462418 IP 192.168.43.213.49838 > 192.168.43.118.800: tcp 0
12:37:18.462459 IP 192.168.43.118.800 > 192.168.43.213.49838: tcp 0
12:37:18.645936 IP 192.168.43.118.8000 > 192.168.43.213.49840: tcp 988
12:37:18.649893 IP 192.168.43.213.49840 > 192.168.43.118.8000: tcp 0
12:37:18.649949 IP 192.168.43.118.8000 > 192.168.43.213.49840: tcp 372
12:37:18.650028 IP 192.168.43.118.8000 > 192.168.43.213.49840: tcp 0
12:37:18.650374 IP 192.168.43.213.49840 > 192.168.43.118.8000: tcp 0
12:37:18.653673 IP 192.168.43.213.49841 > 192.168.43.118.8000: tcp 990
12:37:18.653799 IP 192.168.43.118.8000 > 192.168.43.213.49841: tcp 0
12:37:18.706863 IP 192.168.43.213.49839 > 192.168.43.118.800: tcp 0
12:37:18.706911 IP 192.168.43.118.800 > 192.168.43.213.49839: tcp 0
12:37:18.783671 IP 192.168.43.118.8000 > 192.168.43.213.49841: tcp 939
12:37:18.784209 IP 192.168.43.118.8000 > 192.168.43.213.49841: tcp 5840
12:37:18.784408 IP 192.168.43.213.49841 > 192.168.43.118.8000: tcp 0
12:37:18.784452 IP 192.168.43.118.8000 > 192.168.43.213.49841: tcp 1362
12:37:18.784508 IP 192.168.43.213.49841 > 192.168.43.118.8000: tcp 0
12:37:18.784759 IP 192.168.43.213.49841 > 192.168.43.118.8000: tcp 0
12:37:18.786168 IP 192.168.43.118.8000 > 192.168.43.213.49841: tcp 0
12:37:18.786601 IP 192.168.43.213.49841 > 192.168.43.118.8000: tcp 0
12:37:18.787206 IP 192.168.43.213.49841 > 192.168.43.118.8000: tcp 0
12:37:18.787249 IP 192.168.43.118.8000 > 192.168.43.213.49841: tcp 0
12:37:18.920232 IP 192.168.43.213.49842 > 192.168.43.118.8000: tcp 0
12:37:18.920279 IP 192.168.43.118.8000 > 192.168.43.213.49842: tcp 0
12:37:18.920442 IP 192.168.43.213.49842 > 192.168.43.118.8000: tcp 0
12:37:18.920608 IP 192.168.43.213.49842 > 192.168.43.118.8000: tcp 965
12:37:18.920622 IP 192.168.43.118.8000 > 192.168.43.213.49842: tcp 0
12:37:18.920988 IP 192.168.43.118.8000 > 192.168.43.213.49842: tcp 128
12:37:18.922398 IP 192.168.43.213.49843 > 192.168.43.118.8000: tcp 0
12:37:18.922435 IP 192.168.43.118.8000 > 192.168.43.213.49843: tcp 0
12:37:18.922564 IP 192.168.43.213.49843 > 192.168.43.118.8000: tcp 0
12:37:18.923228 IP 192.168.43.213.49843 > 192.168.43.118.8000: tcp 984
12:37:18.923249 IP 192.168.43.118.8000 > 192.168.43.213.49843: tcp 0
12:37:18.924679 IP 192.168.43.213.49844 > 192.168.43.118.8000: tcp 0
12:37:18.924876 IP 192.168.43.213.49844 > 192.168.43.118.8000: tcp 0
12:37:18.925135 IP 192.168.43.213.49844 > 192.168.43.118.8000: tcp 963
12:37:18.925151 IP 192.168.43.118.8000 > 192.168.43.213.49844: tcp 0
12:37:18.926662 IP 192.168.43.213.49845 > 192.168.43.118.8000: tcp 0
12:37:18.926706 IP 192.168.43.118.8000 > 192.168.43.213.49845: tcp 0
12:37:18.926850 IP 192.168.43.213.49845 > 192.168.43.118.8000: tcp 0
12:37:18.927699 IP 192.168.43.213.49845 > 192.168.43.118.8000: tcp 973
12:37:18.927729 IP 192.168.43.118.8000 > 192.168.43.213.49845: tcp 0
12:37:18.928715 IP 192.168.43.213.49846 > 192.168.43.118.8000: tcp 0
12:37:18.928754 IP 192.168.43.118.8000 > 192.168.43.213.49846: tcp 0
12:37:18.928955 IP 192.168.43.213.49846 > 192.168.43.118.8000: tcp 0
12:37:18.929664 IP 192.168.43.213.49847 > 192.168.43.118.8000: tcp 0
12:37:18.929702 IP 192.168.43.118.8000 > 192.168.43.213.49847: tcp 0
12:37:18.929885 IP 192.168.43.213.49847 > 192.168.43.118.8000: tcp 0
12:37:18.929916 IP 192.168.43.213.49846 > 192.168.43.118.8000: tcp 982
12:37:18.929928 IP 192.168.43.118.8000 > 192.168.43.213.49846: tcp 0
12:37:18.930099 IP 192.168.43.213.49847 > 192.168.43.118.8000: tcp 953
12:37:18.930111 IP 192.168.43.118.8000 > 192.168.43.213.49847: tcp 0
12:37:18.941115 IP 192.168.43.118.8000 > 192.168.43.213.49842: tcp 5840
12:37:18.941184 IP 192.168.43.118.8000 > 192.168.43.213.49842: tcp 5840
12:37:18.941364 IP 192.168.43.118.8000 > 192.168.43.213.49842: tcp 1460
12:37:18.941588 IP 192.168.43.213.49842 > 192.168.43.118.8000: tcp 0
12:37:18.941662 IP 192.168.43.118.8000 > 192.168.43.213.49842: tcp 4380
12:37:18.941697 IP 192.168.43.213.49842 > 192.168.43.118.8000: tcp 0
12:37:18.941707 IP 192.168.43.118.8000 > 192.168.43.213.49842: tcp 2920
12:37:18.941768 IP 192.168.43.213.49842 > 192.168.43.118.8000: tcp 0
12:37:18.941778 IP 192.168.43.213.49842 > 192.168.43.118.8000: tcp 0
12:37:18.941784 IP 192.168.43.118.8000 > 192.168.43.213.49842: tcp 3244
12:37:18.941805 IP 192.168.43.213.49842 > 192.168.43.118.8000: tcp 0
12:37:18.941813 IP 192.168.43.118.8000 > 192.168.43.213.49842: tcp 2920
12:37:18.942079 IP 192.168.43.118.8000 > 192.168.43.213.49842: tcp 1136
12:37:18.942179 IP 192.168.43.118.8000 > 192.168.43.213.49842: tcp 1460
12:37:18.942619 IP 192.168.43.213.49842 > 192.168.43.118.8000: tcp 0
12:37:18.942635 IP 192.168.43.213.49842 > 192.168.43.118.8000: tcp 0
12:37:18.942638 IP 192.168.43.213.49842 > 192.168.43.118.8000: tcp 0
12:37:18.942640 IP 192.168.43.213.49842 > 192.168.43.118.8000: tcp 0
12:37:18.942642 IP 192.168.43.213.49842 > 192.168.43.118.8000: tcp 0
12:37:18.942644 IP 192.168.43.213.49842 > 192.168.43.118.8000: tcp 0
12:37:18.942662 IP 192.168.43.118.8000 > 192.168.43.213.49842: tcp 2920
12:37:18.945346 IP 192.168.43.213.49842 > 192.168.43.118.8000: tcp 0
12:37:18.945378 IP 192.168.43.118.8000 > 192.168.43.213.49842: tcp 1136
12:37:18.945417 IP 192.168.43.213.49842 > 192.168.43.118.8000: tcp 0
12:37:18.945424 IP 192.168.43.213.49842 > 192.168.43.118.8000: tcp 0
12:37:18.945430 IP 192.168.43.118.8000 > 192.168.43.213.49842: tcp 7300
12:37:18.945448 IP 192.168.43.213.49842 > 192.168.43.118.8000: tcp 0
12:37:18.945455 IP 192.168.43.213.49842 > 192.168.43.118.8000: tcp 0
12:37:18.947555 IP 192.168.43.213.49848 > 192.168.43.118.8000: tcp 0
12:37:18.947593 IP 192.168.43.118.8000 > 192.168.43.213.49848: tcp 0
12:37:18.947968 IP 192.168.43.213.49848 > 192.168.43.118.8000: tcp 0
12:37:18.948205 IP 192.168.43.213.49848 > 192.168.43.118.8000: tcp 966
12:37:18.948225 IP 192.168.43.118.8000 > 192.168.43.213.49848: tcp 0
12:37:18.961776 IP 192.168.43.118.8000 > 192.168.43.213.49843: tcp 7300
12:37:18.961856 IP 192.168.43.118.8000 > 192.168.43.213.49843: tcp 5840
12:37:18.961889 IP 192.168.43.118.8000 > 192.168.43.213.49844: tcp 126
12:37:18.962499 IP 192.168.43.213.49843 > 192.168.43.118.8000: tcp 0
12:37:18.962523 IP 192.168.43.118.8000 > 192.168.43.213.49843: tcp 4704
12:37:18.962554 IP 192.168.43.213.49843 > 192.168.43.118.8000: tcp 0
12:37:18.962562 IP 192.168.43.118.8000 > 192.168.43.213.49843: tcp 1460
12:37:18.976410 IP 192.168.43.213.49843 > 192.168.43.118.8000: tcp 0
12:37:18.976441 IP 192.168.43.118.8000 > 192.168.43.213.49843: tcp 0
12:37:18.976474 IP 192.168.43.213.49849 > 192.168.43.118.8000: tcp 0
12:37:18.976489 IP 192.168.43.118.8000 > 192.168.43.213.49849: tcp 0
12:37:18.976723 IP 192.168.43.213.49849 > 192.168.43.118.8000: tcp 0
12:37:18.976884 IP 192.168.43.213.49849 > 192.168.43.118.8000: tcp 969
12:37:18.976897 IP 192.168.43.118.8000 > 192.168.43.213.49849: tcp 0
12:37:18.982827 IP 192.168.43.118.8000 > 192.168.43.213.49844: tcp 5840
12:37:18.982913 IP 192.168.43.118.8000 > 192.168.43.213.49845: tcp 127
12:37:18.983199 IP 192.168.43.213.49844 > 192.168.43.118.8000: tcp 0
12:37:18.983221 IP 192.168.43.118.8000 > 192.168.43.213.49844: tcp 1232
12:37:18.983250 IP 192.168.43.118.8000 > 192.168.43.213.49846: tcp 125
12:37:18.983250 IP 192.168.43.213.49844 > 192.168.43.118.8000: tcp 0
12:37:18.983372 IP 192.168.43.118.8000 > 192.168.43.213.49844: tcp 0
12:37:18.983525 IP 192.168.43.213.49844 > 192.168.43.118.8000: tcp 0
12:37:18.983626 IP 192.168.43.213.49844 > 192.168.43.118.8000: tcp 0
12:37:18.994949 IP 192.168.43.118.8000 > 192.168.43.213.49845: tcp 7300
12:37:18.995028 IP 192.168.43.118.8000 > 192.168.43.213.49845: tcp 5840
12:37:18.995437 IP 192.168.43.213.49845 > 192.168.43.118.8000: tcp 0
12:37:18.995460 IP 192.168.43.118.8000 > 192.168.43.213.49845: tcp 4704
12:37:18.995480 IP 192.168.43.213.49845 > 192.168.43.118.8000: tcp 0
12:37:18.995487 IP 192.168.43.118.8000 > 192.168.43.213.49845: tcp 1460
12:37:18.995500 IP 192.168.43.118.8000 > 192.168.43.213.49845: tcp 1136
12:37:18.996115 IP 192.168.43.213.49845 > 192.168.43.118.8000: tcp 0
12:37:18.996135 IP 192.168.43.213.49845 > 192.168.43.118.8000: tcp 0
12:37:18.996140 IP 192.168.43.213.49845 > 192.168.43.118.8000: tcp 0
12:37:18.996143 IP 192.168.43.213.49845 > 192.168.43.118.8000: tcp 0
12:37:18.996146 IP 192.168.43.213.49845 > 192.168.43.118.8000: tcp 0
12:37:18.996154 IP 192.168.43.118.8000 > 192.168.43.213.49845: tcp 1218
12:37:18.996544 IP 192.168.43.118.8000 > 192.168.43.213.49847: tcp 126
12:37:18.996610 IP 192.168.43.118.8000 > 192.168.43.213.49845: tcp 0
12:37:18.996808 IP 192.168.43.213.49845 > 192.168.43.118.8000: tcp 0
12:37:18.997348 IP 192.168.43.118.8000 > 192.168.43.213.49846: tcp 737
12:37:18.997551 IP 192.168.43.213.49846 > 192.168.43.118.8000: tcp 0
12:37:19.009148 IP 192.168.43.213.49844 > 192.168.43.118.8000: tcp 0
12:37:19.009181 IP 192.168.43.118.8000 > 192.168.43.213.49844: tcp 0
12:37:19.009209 IP 192.168.43.213.49850 > 192.168.43.118.8000: tcp 0
12:37:19.009225 IP 192.168.43.118.8000 > 192.168.43.213.49850: tcp 0
12:37:19.010106 IP 192.168.43.213.49850 > 192.168.43.118.8000: tcp 0
12:37:19.011556 IP 192.168.43.213.49845 > 192.168.43.118.8000: tcp 0
12:37:19.011584 IP 192.168.43.118.8000 > 192.168.43.213.49845: tcp 0
12:37:19.011690 IP 192.168.43.213.49851 > 192.168.43.118.8000: tcp 0
12:37:19.011708 IP 192.168.43.118.8000 > 192.168.43.213.49851: tcp 0
12:37:19.011830 IP 192.168.43.213.49851 > 192.168.43.118.8000: tcp 0
12:37:19.012365 IP 192.168.43.213.49846 > 192.168.43.118.8000: tcp 0
12:37:19.024034 IP 192.168.43.118.8000 > 192.168.43.213.49847: tcp 5840
12:37:19.024097 IP 192.168.43.118.8000 > 192.168.43.213.49848: tcp 125
12:37:19.024729 IP 192.168.43.213.49847 > 192.168.43.118.8000: tcp 0
12:37:19.024753 IP 192.168.43.118.8000 > 192.168.43.213.49847: tcp 309
12:37:19.024780 IP 192.168.43.213.49847 > 192.168.43.118.8000: tcp 0
12:37:19.024901 IP 192.168.43.213.49847 > 192.168.43.118.8000: tcp 0
12:37:19.024918 IP 192.168.43.118.8000 > 192.168.43.213.49847: tcp 0
12:37:19.025102 IP 192.168.43.213.49847 > 192.168.43.118.8000: tcp 0
12:37:19.026816 IP 192.168.43.213.49847 > 192.168.43.118.8000: tcp 0
12:37:19.026848 IP 192.168.43.118.8000 > 192.168.43.213.49847: tcp 0
12:37:19.027087 IP 192.168.43.213.49853 > 192.168.43.118.8000: tcp 0
12:37:19.027110 IP 192.168.43.118.8000 > 192.168.43.213.49853: tcp 0
12:37:19.027794 IP 192.168.43.213.49853 > 192.168.43.118.8000: tcp 0
12:37:19.027831 IP 192.168.43.213.49853 > 192.168.43.118.8000: tcp 945
12:37:19.027843 IP 192.168.43.118.8000 > 192.168.43.213.49853: tcp 0
12:37:19.044862 IP 192.168.43.118.8000 > 192.168.43.213.49849: tcp 126
12:37:19.045504 IP 192.168.43.118.8000 > 192.168.43.213.49850: tcp 125
12:37:19.045563 IP 192.168.43.118.8000 > 192.168.43.213.49848: tcp 559
12:37:19.045782 IP 192.168.43.213.49848 > 192.168.43.118.8000: tcp 0
12:37:19.049790 IP 192.168.43.213.49848 > 192.168.43.118.8000: tcp 0
12:37:19.049829 IP 192.168.43.118.8000 > 192.168.43.213.49848: tcp 0
12:37:19.050127 IP 192.168.43.213.49854 > 192.168.43.118.8000: tcp 0
12:37:19.050217 IP 192.168.43.118.8000 > 192.168.43.213.49854: tcp 0
12:37:19.050768 IP 192.168.43.213.49854 > 192.168.43.118.8000: tcp 0
12:37:19.052103 IP 192.168.43.213.49854 > 192.168.43.118.8000: tcp 957
12:37:19.052135 IP 192.168.43.118.8000 > 192.168.43.213.49854: tcp 0
12:37:19.076107 IP 192.168.43.118.8000 > 192.168.43.213.49849: tcp 5840
12:37:19.076644 IP 192.168.43.213.49849 > 192.168.43.118.8000: tcp 0
12:37:19.076675 IP 192.168.43.118.8000 > 192.168.43.213.49849: tcp 960
12:37:19.076708 IP 192.168.43.213.49849 > 192.168.43.118.8000: tcp 0
12:37:19.076958 IP 192.168.43.213.49849 > 192.168.43.118.8000: tcp 0
12:37:19.076974 IP 192.168.43.213.49849 > 192.168.43.118.8000: tcp 0
12:37:19.077560 IP 192.168.43.213.49855 > 192.168.43.118.8000: tcp 0
12:37:19.077591 IP 192.168.43.118.8000 > 192.168.43.213.49855: tcp 0
12:37:19.077961 IP 192.168.43.213.49855 > 192.168.43.118.8000: tcp 0
12:37:19.078170 IP 192.168.43.213.49855 > 192.168.43.118.8000: tcp 949
12:37:19.078184 IP 192.168.43.118.8000 > 192.168.43.213.49855: tcp 0
12:37:19.096045 IP 192.168.43.118.8000 > 192.168.43.213.49851: tcp 128
12:37:19.096108 IP 192.168.43.118.8000 > 192.168.43.213.49849: tcp 0
12:37:19.096270 IP 192.168.43.213.49849 > 192.168.43.118.8000: tcp 0
12:37:19.096892 IP 192.168.43.118.8000 > 192.168.43.213.49850: tcp 443
12:37:19.097124 IP 192.168.43.213.49850 > 192.168.43.118.8000: tcp 0
12:37:19.097431 IP 192.168.43.213.49850 > 192.168.43.118.8000: tcp 0
12:37:19.097453 IP 192.168.43.118.8000 > 192.168.43.213.49850: tcp 0
12:37:19.097669 IP 192.168.43.213.49856 > 192.168.43.118.8000: tcp 0
12:37:19.097686 IP 192.168.43.118.8000 > 192.168.43.213.49856: tcp 0
12:37:19.097933 IP 192.168.43.213.49856 > 192.168.43.118.8000: tcp 0
12:37:19.098392 IP 192.168.43.213.49856 > 192.168.43.118.8000: tcp 946
12:37:19.098416 IP 192.168.43.118.8000 > 192.168.43.213.49856: tcp 0
12:37:19.137798 IP 192.168.43.118.8000 > 192.168.43.213.49851: tcp 7300
12:37:19.137853 IP 192.168.43.118.8000 > 192.168.43.213.49851: tcp 5840
12:37:19.137896 IP 192.168.43.118.8000 > 192.168.43.213.49852: tcp 126
12:37:19.138209 IP 192.168.43.213.49851 > 192.168.43.118.8000: tcp 0
12:37:19.138231 IP 192.168.43.118.8000 > 192.168.43.213.49851: tcp 2920
12:37:19.138260 IP 192.168.43.118.8000 > 192.168.43.213.49851: tcp 1784
12:37:19.138295 IP 192.168.43.213.49851 > 192.168.43.118.8000: tcp 0
12:37:19.138303 IP 192.168.43.213.49851 > 192.168.43.118.8000: tcp 0
12:37:19.138307 IP 192.168.43.213.49851 > 192.168.43.118.8000: tcp 0
12:37:19.138312 IP 192.168.43.118.8000 > 192.168.43.213.49851: tcp 1460
12:37:19.138353 IP 192.168.43.213.49851 > 192.168.43.118.8000: tcp 0
12:37:19.138361 IP 192.168.43.118.8000 > 192.168.43.213.49851: tcp 1136
12:37:19.138611 IP 192.168.43.118.8000 > 192.168.43.213.49851: tcp 5840
12:37:19.138627 IP 192.168.43.118.8000 > 192.168.43.213.49851: tcp 1784
12:37:19.138644 IP 192.168.43.213.49851 > 192.168.43.118.8000: tcp 0
12:37:19.138651 IP 192.168.43.118.8000 > 192.168.43.213.49851: tcp 2920
12:37:19.138665 IP 192.168.43.213.49851 > 192.168.43.118.8000: tcp 0
12:37:19.138671 IP 192.168.43.118.8000 > 192.168.43.213.49851: tcp 1460
12:37:19.138684 IP 192.168.43.213.49851 > 192.168.43.118.8000: tcp 0
12:37:19.138690 IP 192.168.43.118.8000 > 192.168.43.213.49851: tcp 1136
12:37:19.139853 IP 192.168.43.213.49851 > 192.168.43.118.8000: tcp 0
12:37:19.139866 IP 192.168.43.118.8000 > 192.168.43.213.49851: tcp 1136
12:37:19.139886 IP 192.168.43.118.8000 > 192.168.43.213.49851: tcp 1460
12:37:19.139899 IP 192.168.43.213.49851 > 192.168.43.118.8000: tcp 0
12:37:19.139905 IP 192.168.43.118.8000 > 192.168.43.213.49851: tcp 2920
12:37:19.139919 IP 192.168.43.213.49851 > 192.168.43.118.8000: tcp 0
12:37:19.139925 IP 192.168.43.118.8000 > 192.168.43.213.49851: tcp 2920
12:37:19.140805 IP 192.168.43.213.49851 > 192.168.43.118.8000: tcp 0
12:37:19.140869 IP 192.168.43.213.49851 > 192.168.43.118.8000: tcp 0
12:37:19.140874 IP 192.168.43.213.49851 > 192.168.43.118.8000: tcp 0
12:37:19.155561 IP 192.168.43.118.8000 > 192.168.43.213.49852: tcp 5840
12:37:19.155611 IP 192.168.43.118.8000 > 192.168.43.213.49853: tcp 126
12:37:19.156183 IP 192.168.43.118.8000 > 192.168.43.213.49854: tcp 125
12:37:19.156271 IP 192.168.43.118.8000 > 192.168.43.213.49851: tcp 7300
12:37:19.156296 IP 192.168.43.213.49852 > 192.168.43.118.8000: tcp 0
12:37:19.156300 IP 192.168.43.118.8000 > 192.168.43.213.49851: tcp 7300
12:37:19.156312 IP 192.168.43.118.8000 > 192.168.43.213.49852: tcp 74
12:37:19.156325 IP 192.168.43.118.8000 > 192.168.43.213.49851: tcp 1784
12:37:19.156338 IP 192.168.43.213.49852 > 192.168.43.118.8000: tcp 0
12:37:19.156634 IP 192.168.43.213.49851 > 192.168.43.118.8000: tcp 0
12:37:19.156666 IP 192.168.43.118.8000 > 192.168.43.213.49851: tcp 2920
12:37:19.156689 IP 192.168.43.213.49851 > 192.168.43.118.8000: tcp 0
12:37:19.156694 IP 192.168.43.213.49851 > 192.168.43.118.8000: tcp 0
12:37:19.156699 IP 192.168.43.118.8000 > 192.168.43.213.49851: tcp 4380
12:37:19.156712 IP 192.168.43.213.49851 > 192.168.43.118.8000: tcp 0
12:37:19.156716 IP 192.168.43.213.49851 > 192.168.43.118.8000: tcp 0
12:37:19.156781 IP 192.168.43.118.8000 > 192.168.43.213.49851: tcp 1784
12:37:19.156800 IP 192.168.43.213.49852 > 192.168.43.118.8000: tcp 0
12:37:19.156813 IP 192.168.43.213.49851 > 192.168.43.118.8000: tcp 0
12:37:19.156845 IP 192.168.43.118.8000 > 192.168.43.213.49851: tcp 2920
12:37:19.156861 IP 192.168.43.213.49851 > 192.168.43.118.8000: tcp 0
12:37:19.156868 IP 192.168.43.118.8000 > 192.168.43.213.49851: tcp 1460
12:37:19.156884 IP 192.168.43.118.8000 > 192.168.43.213.49851: tcp 1136
12:37:19.156895 IP 192.168.43.213.49851 > 192.168.43.118.8000: tcp 0
12:37:19.156902 IP 192.168.43.118.8000 > 192.168.43.213.49851: tcp 1460
12:37:19.156915 IP 192.168.43.213.49851 > 192.168.43.118.8000: tcp 0
12:37:19.156920 IP 192.168.43.213.49851 > 192.168.43.118.8000: tcp 0
12:37:19.157473 IP 192.168.43.213.49851 > 192.168.43.118.8000: tcp 0
12:37:19.157515 IP 192.168.43.213.49851 > 192.168.43.118.8000: tcp 0
12:37:19.157522 IP 192.168.43.213.49851 > 192.168.43.118.8000: tcp 0
12:37:19.157532 IP 192.168.43.118.8000 > 192.168.43.213.49851: tcp 927
12:37:19.157784 IP 192.168.43.213.49851 > 192.168.43.118.8000: tcp 0
12:37:19.158958 IP 192.168.43.213.49852 > 192.168.43.118.8000: tcp 0
12:37:19.159019 IP 192.168.43.118.8000 > 192.168.43.213.49852: tcp 0
12:37:19.159227 IP 192.168.43.213.49857 > 192.168.43.118.8000: tcp 0
12:37:19.159249 IP 192.168.43.118.8000 > 192.168.43.213.49857: tcp 0
12:37:19.159732 IP 192.168.43.213.49857 > 192.168.43.118.8000: tcp 0
12:37:19.159761 IP 192.168.43.213.49851 > 192.168.43.118.8000: tcp 0
12:37:19.160032 IP 192.168.43.213.49858 > 192.168.43.118.8000: tcp 0
12:37:19.160486 IP 192.168.43.213.49858 > 192.168.43.118.8000: tcp 0
12:37:19.161393 IP 192.168.43.213.49857 > 192.168.43.118.8000: tcp 953
12:37:19.161416 IP 192.168.43.118.8000 > 192.168.43.213.49857: tcp 0
12:37:19.161444 IP 192.168.43.213.49858 > 192.168.43.118.8000: tcp 954
12:37:19.161450 IP 192.168.43.118.8000 > 192.168.43.213.49858: tcp 0
12:37:19.165084 IP 192.168.43.118.8000 > 192.168.43.213.49853: tcp 7300
12:37:19.165131 IP 192.168.43.118.8000 > 192.168.43.213.49853: tcp 5840
12:37:19.165584 IP 192.168.43.213.49853 > 192.168.43.118.8000: tcp 0
12:37:19.165611 IP 192.168.43.118.8000 > 192.168.43.213.49853: tcp 4704
12:37:19.165639 IP 192.168.43.213.49853 > 192.168.43.118.8000: tcp 0
12:37:19.165647 IP 192.168.43.118.8000 > 192.168.43.213.49853: tcp 1460
12:37:19.165659 IP 192.168.43.118.8000 > 192.168.43.213.49853: tcp 1136
12:37:19.165672 IP 192.168.43.213.49853 > 192.168.43.118.8000: tcp 0
12:37:19.165676 IP 192.168.43.213.49853 > 192.168.43.118.8000: tcp 0
12:37:19.166462 IP 192.168.43.213.49853 > 192.168.43.118.8000: tcp 0
12:37:19.166477 IP 192.168.43.213.49853 > 192.168.43.118.8000: tcp 0
12:37:19.166480 IP 192.168.43.213.49853 > 192.168.43.118.8000: tcp 0
12:37:19.166483 IP 192.168.43.213.49853 > 192.168.43.118.8000: tcp 0
12:37:19.192712 IP 192.168.43.118.8000 > 192.168.43.213.49854: tcp 2920
12:37:19.192775 IP 192.168.43.118.8000 > 192.168.43.213.49851: tcp 0
12:37:19.192809 IP 192.168.43.118.8000 > 192.168.43.213.49855: tcp 127
12:37:19.193239 IP 192.168.43.213.49854 > 192.168.43.118.8000: tcp 0
12:37:19.193271 IP 192.168.43.118.8000 > 192.168.43.213.49854: tcp 75
12:37:19.193289 IP 192.168.43.213.49851 > 192.168.43.118.8000: tcp 0
12:37:19.193405 IP 192.168.43.213.49854 > 192.168.43.118.8000: tcp 0
12:37:19.193690 IP 192.168.43.118.8000 > 192.168.43.213.49854: tcp 0
12:37:19.193768 IP 192.168.43.213.49854 > 192.168.43.118.8000: tcp 0
12:37:19.193850 IP 192.168.43.118.8000 > 192.168.43.213.49856: tcp 127
12:37:19.193941 IP 192.168.43.118.8000 > 192.168.43.213.49853: tcp 0
12:37:19.194055 IP 192.168.43.213.49853 > 192.168.43.118.8000: tcp 0
12:37:19.208209 IP 192.168.43.213.49854 > 192.168.43.118.8000: tcp 0
12:37:19.208279 IP 192.168.43.118.8000 > 192.168.43.213.49854: tcp 0
12:37:19.208512 IP 192.168.43.213.49859 > 192.168.43.118.8000: tcp 0
12:37:19.208550 IP 192.168.43.118.8000 > 192.168.43.213.49859: tcp 0
12:37:19.208742 IP 192.168.43.213.49859 > 192.168.43.118.8000: tcp 0
12:37:19.210400 IP 192.168.43.213.49853 > 192.168.43.118.8000: tcp 0
12:37:19.210434 IP 192.168.43.118.8000 > 192.168.43.213.49853: tcp 0
12:37:19.210464 IP 192.168.43.213.49862 > 192.168.43.118.8000: tcp 0
12:37:19.210479 IP 192.168.43.118.8000 > 192.168.43.213.49862: tcp 0
12:37:19.210495 IP 192.168.43.213.49859 > 192.168.43.118.8000: tcp 964
12:37:19.210505 IP 192.168.43.118.8000 > 192.168.43.213.49859: tcp 0
12:37:19.211598 IP 192.168.43.213.49862 > 192.168.43.118.8000: tcp 0
12:37:19.211641 IP 192.168.43.213.49862 > 192.168.43.118.8000: tcp 955
12:37:19.211652 IP 192.168.43.118.8000 > 192.168.43.213.49862: tcp 0
12:37:19.234702 IP 192.168.43.118.8000 > 192.168.43.213.49855: tcp 7300
12:37:19.234876 IP 192.168.43.118.8000 > 192.168.43.213.49855: tcp 5840
12:37:19.235471 IP 192.168.43.118.8000 > 192.168.43.213.49857: tcp 125
12:37:19.235528 IP 192.168.43.213.49855 > 192.168.43.118.8000: tcp 0
12:37:19.235549 IP 192.168.43.118.8000 > 192.168.43.213.49855: tcp 2920
12:37:19.235586 IP 192.168.43.118.8000 > 192.168.43.213.49855: tcp 1784
12:37:19.235602 IP 192.168.43.213.49855 > 192.168.43.118.8000: tcp 0
12:37:19.235610 IP 192.168.43.213.49855 > 192.168.43.118.8000: tcp 0
12:37:19.235615 IP 192.168.43.213.49855 > 192.168.43.118.8000: tcp 0
12:37:19.235620 IP 192.168.43.118.8000 > 192.168.43.213.49855: tcp 1460
12:37:19.235877 IP 192.168.43.213.49855 > 192.168.43.118.8000: tcp 0
12:37:19.235891 IP 192.168.43.213.49855 > 192.168.43.118.8000: tcp 0
12:37:19.235936 IP 192.168.43.118.8000 > 192.168.43.213.49855: tcp 1136
12:37:19.235980 IP 192.168.43.118.8000 > 192.168.43.213.49855: tcp 7300
12:37:19.235996 IP 192.168.43.213.49855 > 192.168.43.118.8000: tcp 0
12:37:19.236109 IP 192.168.43.118.8000 > 192.168.43.213.49855: tcp 4380
12:37:19.236136 IP 192.168.43.118.8000 > 192.168.43.213.49855: tcp 1460
12:37:19.236712 IP 192.168.43.213.49855 > 192.168.43.118.8000: tcp 0
12:37:19.236726 IP 192.168.43.118.8000 > 192.168.43.213.49855: tcp 1460
12:37:19.236749 IP 192.168.43.118.8000 > 192.168.43.213.49855: tcp 1784
12:37:19.236761 IP 192.168.43.213.49855 > 192.168.43.118.8000: tcp 0
12:37:19.236768 IP 192.168.43.118.8000 > 192.168.43.213.49855: tcp 2920
12:37:19.236782 IP 192.168.43.213.49855 > 192.168.43.118.8000: tcp 0
12:37:19.236788 IP 192.168.43.118.8000 > 192.168.43.213.49855: tcp 1460
12:37:19.237633 IP 192.168.43.213.49855 > 192.168.43.118.8000: tcp 0
12:37:19.237647 IP 192.168.43.213.49855 > 192.168.43.118.8000: tcp 0
12:37:19.237655 IP 192.168.43.118.8000 > 192.168.43.213.49855: tcp 4380
12:37:19.237680 IP 192.168.43.118.8000 > 192.168.43.213.49855: tcp 1136
12:37:19.237697 IP 192.168.43.213.49855 > 192.168.43.118.8000: tcp 0
12:37:19.237702 IP 192.168.43.213.49855 > 192.168.43.118.8000: tcp 0
12:37:19.237707 IP 192.168.43.118.8000 > 192.168.43.213.49855: tcp 5840
12:37:19.237976 IP 192.168.43.213.49855 > 192.168.43.118.8000: tcp 0
12:37:19.237988 IP 192.168.43.118.8000 > 192.168.43.213.49855: tcp 2920
12:37:19.238012 IP 192.168.43.213.49855 > 192.168.43.118.8000: tcp 0
12:37:19.238945 IP 192.168.43.213.49855 > 192.168.43.118.8000: tcp 0
12:37:19.238961 IP 192.168.43.213.49855 > 192.168.43.118.8000: tcp 0
12:37:19.238964 IP 192.168.43.213.49855 > 192.168.43.118.8000: tcp 0
12:37:19.248970 IP 192.168.43.118.8000 > 192.168.43.213.49856: tcp 2920
12:37:19.249023 IP 192.168.43.118.8000 > 192.168.43.213.49856: tcp 2920
12:37:19.249032 IP 192.168.43.118.8000 > 192.168.43.213.49856: tcp 2920
12:37:19.249480 IP 192.168.43.118.8000 > 192.168.43.213.49858: tcp 126
12:37:19.249539 IP 192.168.43.213.49856 > 192.168.43.118.8000: tcp 0
12:37:19.249557 IP 192.168.43.118.8000 > 192.168.43.213.49856: tcp 2920
12:37:19.249590 IP 192.168.43.118.8000 > 192.168.43.213.49856: tcp 2920
12:37:19.249607 IP 192.168.43.213.49856 > 192.168.43.118.8000: tcp 0
12:37:19.249613 IP 192.168.43.213.49856 > 192.168.43.118.8000: tcp 0
12:37:19.250162 IP 192.168.43.213.49856 > 192.168.43.118.8000: tcp 0
12:37:19.250182 IP 192.168.43.118.8000 > 192.168.43.213.49856: tcp 2920
12:37:19.250211 IP 192.168.43.118.8000 > 192.168.43.213.49856: tcp 1460
12:37:19.250224 IP 192.168.43.118.8000 > 192.168.43.213.49856: tcp 7300
12:37:19.250239 IP 192.168.43.213.49856 > 192.168.43.118.8000: tcp 0
12:37:19.250450 IP 192.168.43.213.49856 > 192.168.43.118.8000: tcp 0
12:37:19.250461 IP 192.168.43.118.8000 > 192.168.43.213.49856: tcp 1784
12:37:19.250745 IP 192.168.43.213.49856 > 192.168.43.118.8000: tcp 0
12:37:19.250757 IP 192.168.43.118.8000 > 192.168.43.213.49856: tcp 1460
12:37:19.250782 IP 192.168.43.118.8000 > 192.168.43.213.49856: tcp 5840
12:37:19.250797 IP 192.168.43.213.49856 > 192.168.43.118.8000: tcp 0
12:37:19.250803 IP 192.168.43.118.8000 > 192.168.43.213.49856: tcp 1460
12:37:19.250816 IP 192.168.43.118.8000 > 192.168.43.213.49856: tcp 1784
12:37:19.250830 IP 192.168.43.213.49856 > 192.168.43.118.8000: tcp 0
12:37:19.251608 IP 192.168.43.213.49856 > 192.168.43.118.8000: tcp 0
12:37:19.251617 IP 192.168.43.213.49856 > 192.168.43.118.8000: tcp 0
12:37:19.251619 IP 192.168.43.213.49856 > 192.168.43.118.8000: tcp 0
12:37:19.251621 IP 192.168.43.213.49856 > 192.168.43.118.8000: tcp 0
12:37:19.251625 IP 192.168.43.118.8000 > 192.168.43.213.49856: tcp 1136
12:37:19.252666 IP 192.168.43.213.49856 > 192.168.43.118.8000: tcp 0
12:37:19.254726 IP 192.168.43.118.8000 > 192.168.43.213.49857: tcp 4380
12:37:19.254784 IP 192.168.43.118.8000 > 192.168.43.213.49855: tcp 7300
12:37:19.254799 IP 192.168.43.118.8000 > 192.168.43.213.49855: tcp 7300
12:37:19.254809 IP 192.168.43.118.8000 > 192.168.43.213.49855: tcp 1784
12:37:19.255138 IP 192.168.43.213.49857 > 192.168.43.118.8000: tcp 0
12:37:19.255157 IP 192.168.43.118.8000 > 192.168.43.213.49857: tcp 1113
12:37:19.255177 IP 192.168.43.213.49857 > 192.168.43.118.8000: tcp 0
12:37:19.255183 IP 192.168.43.213.49855 > 192.168.43.118.8000: tcp 0
12:37:19.255187 IP 192.168.43.213.49855 > 192.168.43.118.8000: tcp 0
12:37:19.255193 IP 192.168.43.118.8000 > 192.168.43.213.49855: tcp 5840
12:37:19.255216 IP 192.168.43.213.49855 > 192.168.43.118.8000: tcp 0
12:37:19.255746 IP 192.168.43.213.49855 > 192.168.43.118.8000: tcp 0
12:37:19.255758 IP 192.168.43.118.8000 > 192.168.43.213.49855: tcp 808
12:37:19.255784 IP 192.168.43.213.49855 > 192.168.43.118.8000: tcp 0
12:37:19.255789 IP 192.168.43.213.49855 > 192.168.43.118.8000: tcp 0
12:37:19.255793 IP 192.168.43.213.49855 > 192.168.43.118.8000: tcp 0
12:37:19.255796 IP 192.168.43.213.49855 > 192.168.43.118.8000: tcp 0
12:37:19.256147 IP 192.168.43.213.49855 > 192.168.43.118.8000: tcp 0
12:37:19.256160 IP 192.168.43.213.49857 > 192.168.43.118.8000: tcp 0
12:37:19.256541 IP 192.168.43.213.49863 > 192.168.43.118.8000: tcp 0
12:37:19.256550 IP 192.168.43.118.8000 > 192.168.43.213.49858: tcp 2920
12:37:19.256594 IP 192.168.43.118.8000 > 192.168.43.213.49863: tcp 0
12:37:19.256616 IP 192.168.43.118.8000 > 192.168.43.213.49858: tcp 2920
12:37:19.256634 IP 192.168.43.118.8000 > 192.168.43.213.49858: tcp 2920
12:37:19.256666 IP 192.168.43.118.8000 > 192.168.43.213.49857: tcp 0
12:37:19.256688 IP 192.168.43.118.8000 > 192.168.43.213.49856: tcp 7300
12:37:19.263394 IP 192.168.43.213.49865 > 192.168.43.118.8000: tcp 0
12:37:19.263447 IP 192.168.43.118.8000 > 192.168.43.213.49865: tcp 0
12:37:19.263477 IP 192.168.43.213.49864 > 192.168.43.118.8000: tcp 955
12:37:19.263487 IP 192.168.43.118.8000 > 192.168.43.213.49864: tcp 0
12:37:19.264412 IP 192.168.43.213.49865 > 192.168.43.118.8000: tcp 0
12:37:19.264446 IP 192.168.43.213.49865 > 192.168.43.118.8000: tcp 952
12:37:19.264458 IP 192.168.43.118.8000 > 192.168.43.213.49865: tcp 0
12:37:19.298684 IP 192.168.43.118.8000 > 192.168.43.213.49859: tcp 7300
12:37:19.298818 IP 192.168.43.118.8000 > 192.168.43.213.49859: tcp 5840
12:37:19.298847 IP 192.168.43.118.8000 > 192.168.43.213.49862: tcp 125
12:37:19.299199 IP 192.168.43.213.49859 > 192.168.43.118.8000: tcp 0
12:37:19.299239 IP 192.168.43.118.8000 > 192.168.43.213.49859: tcp 4704
12:37:19.299265 IP 192.168.43.213.49859 > 192.168.43.118.8000: tcp 0
12:37:19.299273 IP 192.168.43.118.8000 > 192.168.43.213.49859: tcp 1460
12:37:19.299329 IP 192.168.43.213.49859 > 192.168.43.118.8000: tcp 0
12:37:19.299337 IP 192.168.43.118.8000 > 192.168.43.213.49859: tcp 1136
12:37:19.299355 IP 192.168.43.213.49859 > 192.168.43.118.8000: tcp 0
12:37:19.299362 IP 192.168.43.118.8000 > 192.168.43.213.49859: tcp 2920
12:37:19.299378 IP 192.168.43.213.49859 > 192.168.43.118.8000: tcp 0
12:37:19.299383 IP 192.168.43.118.8000 > 192.168.43.213.49859: tcp 2920
12:37:19.299641 IP 192.168.43.118.8000 > 192.168.43.213.49856: tcp 0
12:37:19.299696 IP 192.168.43.118.8000 > 192.168.43.213.49859: tcp 1122
12:37:19.299723 IP 192.168.43.118.8000 > 192.168.43.213.49855: tcp 5188
12:37:19.299837 IP 192.168.43.213.49859 > 192.168.43.118.8000: tcp 0
12:37:19.299850 IP 192.168.43.213.49859 > 192.168.43.118.8000: tcp 0
12:37:19.299879 IP 192.168.43.213.49859 > 192.168.43.118.8000: tcp 0
12:37:19.299884 IP 192.168.43.213.49859 > 192.168.43.118.8000: tcp 0
12:37:19.299887 IP 192.168.43.213.49859 > 192.168.43.118.8000: tcp 0
12:37:19.299891 IP 192.168.43.213.49856 > 192.168.43.118.8000: tcp 0
12:37:19.299901 IP 192.168.43.213.49859 > 192.168.43.118.8000: tcp 0
12:37:19.299908 IP 192.168.43.213.49855 > 192.168.43.118.8000: tcp 0
12:37:19.331155 IP 192.168.43.213.49859 > 192.168.43.118.8000: tcp 0
12:37:19.331211 IP 192.168.43.118.8000 > 192.168.43.213.49859: tcp 0
12:37:19.331876 IP 192.168.43.213.49866 > 192.168.43.118.8000: tcp 0
12:37:19.331927 IP 192.168.43.118.8000 > 192.168.43.213.49866: tcp 0
12:37:19.332665 IP 192.168.43.213.49866 > 192.168.43.118.8000: tcp 0
12:37:19.332716 IP 192.168.43.213.49866 > 192.168.43.118.8000: tcp 962
12:37:19.332727 IP 192.168.43.118.8000 > 192.168.43.213.49866: tcp 0
12:37:19.345401 IP 192.168.43.118.8000 > 192.168.43.213.49862: tcp 5840
12:37:19.345652 IP 192.168.43.213.49862 > 192.168.43.118.8000: tcp 0
12:37:19.345673 IP 192.168.43.213.49862 > 192.168.43.118.8000: tcp 0
12:37:19.345718 IP 192.168.43.118.8000 > 192.168.43.213.49862: tcp 61
12:37:19.345787 IP 192.168.43.213.49862 > 192.168.43.118.8000: tcp 0
12:37:19.346070 IP 192.168.43.118.8000 > 192.168.43.213.49863: tcp 126
12:37:19.346286 IP 192.168.43.118.8000 > 192.168.43.213.49855: tcp 7300
12:37:19.346392 IP 192.168.43.118.8000 > 192.168.43.213.49855: tcp 7300
12:37:19.346456 IP 192.168.43.118.8000 > 192.168.43.213.49862: tcp 0
12:37:19.346815 IP 192.168.43.213.49855 > 192.168.43.118.8000: tcp 0
12:37:19.346849 IP 192.168.43.118.8000 > 192.168.43.213.49855: tcp 2920
12:37:19.346874 IP 192.168.43.213.49855 > 192.168.43.118.8000: tcp 0
12:37:19.346882 IP 192.168.43.118.8000 > 192.168.43.213.49855: tcp 2920
12:37:19.346893 IP 192.168.43.213.49855 > 192.168.43.118.8000: tcp 0
12:37:19.346910 IP 192.168.43.213.49855 > 192.168.43.118.8000: tcp 0
12:37:19.346914 IP 192.168.43.213.49855 > 192.168.43.118.8000: tcp 0
12:37:19.346917 IP 192.168.43.213.49862 > 192.168.43.118.8000: tcp 0
12:37:19.346928 IP 192.168.43.213.49855 > 192.168.43.118.8000: tcp 0
12:37:19.347212 IP 192.168.43.118.8000 > 192.168.43.213.49863: tcp 7300
12:37:19.347292 IP 192.168.43.213.49855 > 192.168.43.118.8000: tcp 0
12:37:19.347323 IP 192.168.43.118.8000 > 192.168.43.213.49855: tcp 1460
12:37:19.347339 IP 192.168.43.118.8000 > 192.168.43.213.49855: tcp 5840
12:37:19.347353 IP 192.168.43.213.49863 > 192.168.43.118.8000: tcp 0
12:37:19.347356 IP 192.168.43.213.49863 > 192.168.43.118.8000: tcp 0
12:37:19.347407 IP 192.168.43.118.8000 > 192.168.43.213.49863: tcp 5840
12:37:19.347449 IP 192.168.43.118.8000 > 192.168.43.213.49863: tcp 1215
12:37:19.347475 IP 192.168.43.118.8000 > 192.168.43.213.49864: tcp 125
12:37:19.347615 IP 192.168.43.213.49863 > 192.168.43.118.8000: tcp 0
12:37:19.347642 IP 192.168.43.213.49855 > 192.168.43.118.8000: tcp 0
12:37:19.347648 IP 192.168.43.118.8000 > 192.168.43.213.49855: tcp 1460
12:37:19.347687 IP 192.168.43.118.8000 > 192.168.43.213.49855: tcp 7300
12:37:19.347712 IP 192.168.43.213.49855 > 192.168.43.118.8000: tcp 0
12:37:19.347738 IP 192.168.43.213.49855 > 192.168.43.118.8000: tcp 0
12:37:19.347742 IP 192.168.43.213.49863 > 192.168.43.118.8000: tcp 0
12:37:19.347746 IP 192.168.43.213.49863 > 192.168.43.118.8000: tcp 0
12:37:19.347749 IP 192.168.43.213.49855 > 192.168.43.118.8000: tcp 0
12:37:19.347754 IP 192.168.43.118.8000 > 192.168.43.213.49855: tcp 1784
12:37:19.347897 IP 192.168.43.213.49855 > 192.168.43.118.8000: tcp 0
12:37:19.347916 IP 192.168.43.118.8000 > 192.168.43.213.49855: tcp 4380
12:37:19.347932 IP 192.168.43.118.8000 > 192.168.43.213.49855: tcp 1136
12:37:19.347940 IP 192.168.43.118.8000 > 192.168.43.213.49855: tcp 5840
12:37:19.347948 IP 192.168.43.213.49855 > 192.168.43.118.8000: tcp 0
12:37:19.347951 IP 192.168.43.118.8000 > 192.168.43.213.49855: tcp 1460
12:37:19.347959 IP 192.168.43.213.49855 > 192.168.43.118.8000: tcp 0
12:37:19.348157 IP 192.168.43.118.8000 > 192.168.43.213.49863: tcp 0
12:37:19.348212 IP 192.168.43.213.49855 > 192.168.43.118.8000: tcp 0
12:37:19.348237 IP 192.168.43.118.8000 > 192.168.43.213.49855: tcp 1460
12:37:19.348252 IP 192.168.43.118.8000 > 192.168.43.213.49855: tcp 4380
12:37:19.348260 IP 192.168.43.213.49855 > 192.168.43.118.8000: tcp 0
12:37:19.348264 IP 192.168.43.118.8000 > 192.168.43.213.49855: tcp 1460
12:37:19.348271 IP 192.168.43.118.8000 > 192.168.43.213.49855: tcp 1784
12:37:19.348281 IP 192.168.43.213.49855 > 192.168.43.118.8000: tcp 0
12:37:19.348286 IP 192.168.43.118.8000 > 192.168.43.213.49855: tcp 2920
12:37:19.348296 IP 192.168.43.213.49855 > 192.168.43.118.8000: tcp 0
12:37:19.348300 IP 192.168.43.118.8000 > 192.168.43.213.49855: tcp 1460
12:37:19.348306 IP 192.168.43.118.8000 > 192.168.43.213.49855: tcp 1136
12:37:19.348332 IP 192.168.43.213.49863 > 192.168.43.118.8000: tcp 0
12:37:19.348334 IP 192.168.43.213.49855 > 192.168.43.118.8000: tcp 0
12:37:19.348339 IP 192.168.43.118.8000 > 192.168.43.213.49855: tcp 2920
12:37:19.348347 IP 192.168.43.213.49855 > 192.168.43.118.8000: tcp 0
12:37:19.348351 IP 192.168.43.118.8000 > 192.168.43.213.49855: tcp 2920
12:37:19.348738 IP 192.168.43.213.49855 > 192.168.43.118.8000: tcp 0
12:37:19.348750 IP 192.168.43.118.8000 > 192.168.43.213.49855: tcp 1460
12:37:19.348788 IP 192.168.43.213.49855 > 192.168.43.118.8000: tcp 0
12:37:19.348792 IP 192.168.43.213.49855 > 192.168.43.118.8000: tcp 0
12:37:19.348796 IP 192.168.43.118.8000 > 192.168.43.213.49855: tcp 5840
12:37:19.348813 IP 192.168.43.213.49855 > 192.168.43.118.8000: tcp 0
12:37:19.348816 IP 192.168.43.118.8000 > 192.168.43.213.49855: tcp 1460
12:37:19.348824 IP 192.168.43.213.49855 > 192.168.43.118.8000: tcp 0
12:37:19.348826 IP 192.168.43.213.49855 > 192.168.43.118.8000: tcp 0
12:37:19.348828 IP 192.168.43.118.8000 > 192.168.43.213.49855: tcp 7300
12:37:19.348906 IP 192.168.43.213.49855 > 192.168.43.118.8000: tcp 0
12:37:19.349002 IP 192.168.43.118.8000 > 192.168.43.213.49855: tcp 3244
12:37:19.349014 IP 192.168.43.213.49855 > 192.168.43.118.8000: tcp 0
12:37:19.349023 IP 192.168.43.118.8000 > 192.168.43.213.49855: tcp 2920
12:37:19.349034 IP 192.168.43.213.49855 > 192.168.43.118.8000: tcp 0
12:37:19.349039 IP 192.168.43.118.8000 > 192.168.43.213.49855: tcp 1136
12:37:19.349051 IP 192.168.43.213.49855 > 192.168.43.118.8000: tcp 0
12:37:19.349054 IP 192.168.43.213.49855 > 192.168.43.118.8000: tcp 0
12:37:19.349209 IP 192.168.43.213.49855 > 192.168.43.118.8000: tcp 0
12:37:19.349228 IP 192.168.43.213.49855 > 192.168.43.118.8000: tcp 0
12:37:19.349230 IP 192.168.43.213.49855 > 192.168.43.118.8000: tcp 0
12:37:19.349580 IP 192.168.43.118.8000 > 192.168.43.213.49864: tcp 4380
12:37:19.349626 IP 192.168.43.118.8000 > 192.168.43.213.49865: tcp 125
12:37:19.349657 IP 192.168.43.118.8000 > 192.168.43.213.49864: tcp 130
12:37:19.349848 IP 192.168.43.213.49864 > 192.168.43.118.8000: tcp 0
12:37:19.349879 IP 192.168.43.213.49864 > 192.168.43.118.8000: tcp 0
12:37:19.349883 IP 192.168.43.213.49864 > 192.168.43.118.8000: tcp 0
12:37:19.361376 IP 192.168.43.213.49855 > 192.168.43.118.8000: tcp 0
12:37:19.361426 IP 192.168.43.118.8000 > 192.168.43.213.49855: tcp 7300
12:37:19.361460 IP 192.168.43.118.8000 > 192.168.43.213.49855: tcp 7300
12:37:19.361477 IP 192.168.43.118.8000 > 192.168.43.213.49855: tcp 1784
12:37:19.361693 IP 192.168.43.213.49855 > 192.168.43.118.8000: tcp 0
12:37:19.361727 IP 192.168.43.118.8000 > 192.168.43.213.49855: tcp 1460
12:37:19.361752 IP 192.168.43.213.49855 > 192.168.43.118.8000: tcp 0
12:37:19.361759 IP 192.168.43.118.8000 > 192.168.43.213.49855: tcp 2920
12:37:19.361774 IP 192.168.43.213.49855 > 192.168.43.118.8000: tcp 0
12:37:19.361780 IP 192.168.43.118.8000 > 192.168.43.213.49855: tcp 1136
12:37:19.361794 IP 192.168.43.118.8000 > 192.168.43.213.49855: tcp 1460
12:37:19.361846 IP 192.168.43.213.49855 > 192.168.43.118.8000: tcp 0
12:37:19.361855 IP 192.168.43.118.8000 > 192.168.43.213.49855: tcp 2920
12:37:19.361870 IP 192.168.43.213.49862 > 192.168.43.118.8000: tcp 0
12:37:19.361886 IP 192.168.43.118.8000 > 192.168.43.213.49862: tcp 0
12:37:19.361899 IP 192.168.43.213.49855 > 192.168.43.118.8000: tcp 0
12:37:19.361905 IP 192.168.43.118.8000 > 192.168.43.213.49855: tcp 2920
12:37:19.361919 IP 192.168.43.213.49855 > 192.168.43.118.8000: tcp 0
12:37:19.361957 IP 192.168.43.118.8000 > 192.168.43.213.49855: tcp 2920
12:37:19.361972 IP 192.168.43.213.49855 > 192.168.43.118.8000: tcp 0
12:37:19.361979 IP 192.168.43.118.8000 > 192.168.43.213.49855: tcp 1460
12:37:19.361992 IP 192.168.43.213.49855 > 192.168.43.118.8000: tcp 0
12:37:19.361997 IP 192.168.43.213.49855 > 192.168.43.118.8000: tcp 0
12:37:19.362001 IP 192.168.43.213.49855 > 192.168.43.118.8000: tcp 0
12:37:19.362101 IP 192.168.43.213.49867 > 192.168.43.118.8000: tcp 0
12:37:19.362137 IP 192.168.43.118.8000 > 192.168.43.213.49867: tcp 0
12:37:19.362159 IP 192.168.43.213.49855 > 192.168.43.118.8000: tcp 0
12:37:19.362166 IP 192.168.43.213.49855 > 192.168.43.118.8000: tcp 0
