11:46:16.975066 IP 192.168.1.16.55339 > 192.168.1.22.8000: tcp 0
11:46:16.975103 IP 192.168.1.22.8000 > 192.168.1.16.55339: tcp 0
11:46:16.976493 IP 192.168.1.16.55339 > 192.168.1.22.8000: tcp 0
11:46:16.977044 IP 192.168.1.16.55339 > 192.168.1.22.8000: tcp 1058
11:46:16.977098 IP 192.168.1.22.8000 > 192.168.1.16.55339: tcp 0
11:46:17.007788 IP 192.168.1.22.8000 > 192.168.1.16.55339: tcp 941
11:46:17.007885 IP 192.168.1.22.8000 > 192.168.1.16.55339: tcp 7300
11:46:17.007926 IP 192.168.1.22.8000 > 192.168.1.16.55339: tcp 5840
11:46:17.018030 IP 192.168.1.22.8000 > 192.168.1.16.55339: tcp 1460
11:46:17.043208 IP 192.168.1.16.55339 > 192.168.1.22.8000: tcp 0
11:46:17.043229 IP 192.168.1.22.8000 > 192.168.1.16.55339: tcp 426
11:46:17.056863 IP 192.168.1.22.8000 > 192.168.1.16.55339: tcp 426
11:46:17.088268 IP 192.168.1.16.55339 > 192.168.1.22.8000: tcp 0
11:46:17.088293 IP 192.168.1.16.55339 > 192.168.1.22.8000: tcp 0
11:46:17.088296 IP 192.168.1.16.55339 > 192.168.1.22.8000: tcp 0
11:46:17.088298 IP 192.168.1.16.55339 > 192.168.1.22.8000: tcp 0
11:46:17.089285 IP 192.168.1.16.55339 > 192.168.1.22.8000: tcp 0
11:46:17.089313 IP 192.168.1.16.55339 > 192.168.1.22.8000: tcp 0
11:46:17.089320 IP 192.168.1.22.8000 > 192.168.1.16.55339: tcp 0
11:46:17.089331 IP 192.168.1.16.55339 > 192.168.1.22.8000: tcp 0
11:46:17.089333 IP 192.168.1.16.55340 > 192.168.1.22.8000: tcp 0
11:46:17.089338 IP 192.168.1.22.8000 > 192.168.1.16.55340: tcp 0
11:46:17.089345 IP 192.168.1.16.55341 > 192.168.1.22.8000: tcp 0
11:46:17.090699 IP 192.168.1.16.55340 > 192.168.1.22.8000: tcp 0
11:46:17.091632 IP 192.168.1.16.55341 > 192.168.1.22.8000: tcp 0
11:46:17.091667 IP 192.168.1.16.55343 > 192.168.1.22.8000: tcp 0
11:46:17.091671 IP 192.168.1.16.55344 > 192.168.1.22.8000: tcp 0
11:46:17.091673 IP 192.168.1.16.55342 > 192.168.1.22.8000: tcp 0
11:46:17.091678 IP 192.168.1.16.55345 > 192.168.1.22.8000: tcp 0
11:46:17.091682 IP 192.168.1.16.55343 > 192.168.1.22.8000: tcp 995
11:46:17.091715 IP 192.168.1.22.8000 > 192.168.1.16.55343: tcp 0
11:46:17.093033 IP 192.168.1.16.55345 > 192.168.1.22.8000: tcp 983
11:46:17.093040 IP 192.168.1.22.8000 > 192.168.1.16.55345: tcp 0
11:46:17.093282 IP 192.168.1.22.8000 > 192.168.1.16.55343: tcp 126
11:46:17.093462 IP 192.168.1.22.8000 > 192.168.1.16.55340: tcp 124
11:46:17.093477 IP 192.168.1.22.8000 > 192.168.1.16.55341: tcp 125
11:46:17.093525 IP 192.168.1.22.8000 > 192.168.1.16.55343: tcp 7300
11:46:17.093558 IP 192.168.1.22.8000 > 192.168.1.16.55343: tcp 5840
11:46:17.093670 IP 192.168.1.22.8000 > 192.168.1.16.55344: tcp 125
11:46:17.093684 IP 192.168.1.22.8000 > 192.168.1.16.55340: tcp 5840
11:46:17.093699 IP 192.168.1.22.8000 > 192.168.1.16.55341: tcp 7300
11:46:17.093709 IP 192.168.1.22.8000 > 192.168.1.16.55341: tcp 5840
11:46:17.093739 IP 192.168.1.22.8000 > 192.168.1.16.55344: tcp 7300
11:46:17.102402 IP 192.168.1.16.55343 > 192.168.1.22.8000: tcp 0
11:46:17.102445 IP 192.168.1.22.8000 > 192.168.1.16.55343: tcp 5840
11:46:17.103178 IP 192.168.1.16.55343 > 192.168.1.22.8000: tcp 0
11:46:17.103187 IP 192.168.1.16.55343 > 192.168.1.22.8000: tcp 0
11:46:17.103191 IP 192.168.1.22.8000 > 192.168.1.16.55343: tcp 11680
11:46:17.103223 IP 192.168.1.16.55343 > 192.168.1.22.8000: tcp 0
11:46:17.103237 IP 192.168.1.16.55343 > 192.168.1.22.8000: tcp 0
11:46:17.103240 IP 192.168.1.22.8000 > 192.168.1.16.55343: tcp 11680
11:46:17.103249 IP 192.168.1.16.55340 > 192.168.1.22.8000: tcp 0
11:46:17.108966 IP 192.168.1.22.8000 > 192.168.1.16.55345: tcp 309
11:46:17.109033 IP 192.168.1.22.8000 > 192.168.1.16.55342: tcp 737
11:46:17.112637 IP 192.168.1.16.55340 > 192.168.1.22.8000: tcp 0
11:46:17.112660 IP 192.168.1.16.55340 > 192.168.1.22.8000: tcp 0
11:46:17.112681 IP 192.168.1.22.8000 > 192.168.1.16.55340: tcp 0
11:46:17.112693 IP 192.168.1.16.55346 > 192.168.1.22.8000: tcp 0
11:46:17.112713 IP 192.168.1.22.8000 > 192.168.1.16.55346: tcp 0
11:46:17.112719 IP 192.168.1.16.55342 > 192.168.1.22.8000: tcp 0
11:46:17.112724 IP 192.168.1.16.55345 > 192.168.1.22.8000: tcp 0
11:46:17.113335 IP 192.168.1.22.8000 > 192.168.1.16.55343: tcp 11680
11:46:17.122755 IP 192.168.1.22.8000 > 192.168.1.16.55344: tcp 1218
11:46:17.122810 IP 192.168.1.16.55341 > 192.168.1.22.8000: tcp 0
11:46:17.122830 IP 192.168.1.16.55344 > 192.168.1.22.8000: tcp 0
11:46:17.122834 IP 192.168.1.16.55344 > 192.168.1.22.8000: tcp 0
11:46:17.122835 IP 192.168.1.16.55344 > 192.168.1.22.8000: tcp 0
11:46:17.122841 IP 192.168.1.16.55345 > 192.168.1.22.8000: tcp 0
11:46:17.122844 IP 192.168.1.16.55342 > 192.168.1.22.8000: tcp 0
11:46:17.127548 IP 192.168.1.16.55346 > 192.168.1.22.8000: tcp 0
11:46:17.127602 IP 192.168.1.16.55347 > 192.168.1.22.8000: tcp 0
11:46:17.127608 IP 192.168.1.16.55348 > 192.168.1.22.8000: tcp 0
11:46:17.127611 IP 192.168.1.16.55346 > 192.168.1.22.8000: tcp 996
11:46:17.127616 IP 192.168.1.22.8000 > 192.168.1.16.55346: tcp 0
11:46:17.127629 IP 192.168.1.16.55348 > 192.168.1.22.8000: tcp 999
11:46:17.127631 IP 192.168.1.22.8000 > 192.168.1.16.55348: tcp 0
11:46:17.127938 IP 192.168.1.16.55347 > 192.168.1.22.8000: tcp 996
11:46:17.127942 IP 192.168.1.22.8000 > 192.168.1.16.55347: tcp 0
11:46:17.127950 IP 192.168.1.16.55343 > 192.168.1.22.8000: tcp 0
11:46:17.127982 IP 192.168.1.16.55343 > 192.168.1.22.8000: tcp 0
11:46:17.127984 IP 192.168.1.16.55343 > 192.168.1.22.8000: tcp 0
11:46:17.127985 IP 192.168.1.16.55343 > 192.168.1.22.8000: tcp 0
11:46:17.127986 IP 192.168.1.16.55343 > 192.168.1.22.8000: tcp 0
11:46:17.127988 IP 192.168.1.16.55343 > 192.168.1.22.8000: tcp 0
11:46:17.127989 IP 192.168.1.16.55343 > 192.168.1.22.8000: tcp 0
11:46:17.127992 IP 192.168.1.16.55343 > 192.168.1.22.8000: tcp 0
11:46:17.127993 IP 192.168.1.16.55343 > 192.168.1.22.8000: tcp 0
11:46:17.128033 IP 192.168.1.22.8000 > 192.168.1.16.55348: tcp 124
11:46:17.128060 IP 192.168.1.22.8000 > 192.168.1.16.55346: tcp 559
11:46:17.128076 IP 192.168.1.22.8000 > 192.168.1.16.55347: tcp 123
11:46:17.128111 IP 192.168.1.22.8000 > 192.168.1.16.55348: tcp 2920
11:46:17.128122 IP 192.168.1.22.8000 > 192.168.1.16.55348: tcp 2920
11:46:17.128143 IP 192.168.1.22.8000 > 192.168.1.16.55347: tcp 443
11:46:17.128204 IP 192.168.1.22.8000 > 192.168.1.16.55348: tcp 960
11:46:17.130135 IP 192.168.1.16.55343 > 192.168.1.22.8000: tcp 0
11:46:17.130181 IP 192.168.1.16.55343 > 192.168.1.22.8000: tcp 0
11:46:17.130209 IP 192.168.1.16.55343 > 192.168.1.22.8000: tcp 0
11:46:17.130234 IP 192.168.1.16.55343 > 192.168.1.22.8000: tcp 0
11:46:17.130261 IP 192.168.1.16.55343 > 192.168.1.22.8000: tcp 0
11:46:17.130289 IP 192.168.1.16.55343 > 192.168.1.22.8000: tcp 0
11:46:17.130316 IP 192.168.1.16.55343 > 192.168.1.22.8000: tcp 0
11:46:17.130342 IP 192.168.1.16.55343 > 192.168.1.22.8000: tcp 0
11:46:17.130369 IP 192.168.1.16.55343 > 192.168.1.22.8000: tcp 0
11:46:17.130395 IP 192.168.1.16.55343 > 192.168.1.22.8000: tcp 0
11:46:17.130411 IP 192.168.1.16.55343 > 192.168.1.22.8000: tcp 0
11:46:17.130426 IP 192.168.1.16.55344 > 192.168.1.22.8000: tcp 0
11:46:17.133614 IP 192.168.1.16.55346 > 192.168.1.22.8000: tcp 0
11:46:17.133638 IP 192.168.1.16.55348 > 192.168.1.22.8000: tcp 0
11:46:17.133666 IP 192.168.1.16.55348 > 192.168.1.22.8000: tcp 0
11:46:17.133693 IP 192.168.1.16.55347 > 192.168.1.22.8000: tcp 0
11:46:17.133702 IP 192.168.1.16.55348 > 192.168.1.22.8000: tcp 0
11:46:17.149218 IP 192.168.1.16.55343 > 192.168.1.22.8000: tcp 0
11:46:17.149676 IP 192.168.1.16.55341 > 192.168.1.22.8000: tcp 0
11:46:17.149728 IP 192.168.1.22.8000 > 192.168.1.16.55341: tcp 0
11:46:17.150101 IP 192.168.1.16.55349 > 192.168.1.22.8000: tcp 0
11:46:17.150124 IP 192.168.1.22.8000 > 192.168.1.16.55349: tcp 0
11:46:17.150886 IP 192.168.1.16.55344 > 192.168.1.22.8000: tcp 0
11:46:17.150928 IP 192.168.1.22.8000 > 192.168.1.16.55344: tcp 0
11:46:17.150944 IP 192.168.1.16.55350 > 192.168.1.22.8000: tcp 0
11:46:17.150953 IP 192.168.1.22.8000 > 192.168.1.16.55350: tcp 0
11:46:17.151279 IP 192.168.1.16.55349 > 192.168.1.22.8000: tcp 0
11:46:17.152027 IP 192.168.1.16.55343 > 192.168.1.22.8000: tcp 0
11:46:17.152065 IP 192.168.1.22.8000 > 192.168.1.16.55343: tcp 0
11:46:17.152722 IP 192.168.1.16.55351 > 192.168.1.22.8000: tcp 0
11:46:17.152785 IP 192.168.1.22.8000 > 192.168.1.16.55351: tcp 0
11:46:17.155005 IP 192.168.1.16.55349 > 192.168.1.22.8000: tcp 983
11:46:17.155038 IP 192.168.1.22.8000 > 192.168.1.16.55349: tcp 0
11:46:17.155063 IP 192.168.1.16.55348 > 192.168.1.22.8000: tcp 0
11:46:17.155098 IP 192.168.1.22.8000 > 192.168.1.16.55348: tcp 0
11:46:17.155120 IP 192.168.1.16.55352 > 192.168.1.22.8000: tcp 0
11:46:17.155130 IP 192.168.1.22.8000 > 192.168.1.16.55352: tcp 0
11:46:17.155137 IP 192.168.1.16.55350 > 192.168.1.22.8000: tcp 0
11:46:17.155146 IP 192.168.1.16.55346 > 192.168.1.22.8000: tcp 0
11:46:17.155160 IP 192.168.1.22.8000 > 192.168.1.16.55346: tcp 0
11:46:17.155165 IP 192.168.1.16.55353 > 192.168.1.22.8000: tcp 0
11:46:17.155169 IP 192.168.1.22.8000 > 192.168.1.16.55353: tcp 0
11:46:17.155294 IP 192.168.1.22.8000 > 192.168.1.16.55349: tcp 126
11:46:17.155346 IP 192.168.1.22.8000 > 192.168.1.16.55349: tcp 7300
11:46:17.155375 IP 192.168.1.22.8000 > 192.168.1.16.55349: tcp 5840
11:46:17.158585 IP 192.168.1.16.55347 > 192.168.1.22.8000: tcp 0
11:46:17.158646 IP 192.168.1.22.8000 > 192.168.1.16.55347: tcp 0
11:46:17.158658 IP 192.168.1.16.55354 > 192.168.1.22.8000: tcp 0
11:46:17.158663 IP 192.168.1.22.8000 > 192.168.1.16.55354: tcp 0
11:46:17.158683 IP 192.168.1.16.55351 > 192.168.1.22.8000: tcp 0
11:46:17.158700 IP 192.168.1.16.55350 > 192.168.1.22.8000: tcp 994
11:46:17.158730 IP 192.168.1.22.8000 > 192.168.1.16.55350: tcp 0
11:46:17.158743 IP 192.168.1.16.55351 > 192.168.1.22.8000: tcp 975
11:46:17.158745 IP 192.168.1.22.8000 > 192.168.1.16.55351: tcp 0
11:46:17.159807 IP 192.168.1.22.8000 > 192.168.1.16.55350: tcp 124
11:46:17.159866 IP 192.168.1.22.8000 > 192.168.1.16.55351: tcp 124
11:46:17.159916 IP 192.168.1.22.8000 > 192.168.1.16.55350: tcp 5840
11:46:17.160013 IP 192.168.1.22.8000 > 192.168.1.16.55351: tcp 2920
11:46:17.160038 IP 192.168.1.22.8000 > 192.168.1.16.55351: tcp 2920
11:46:17.160188 IP 192.168.1.22.8000 > 192.168.1.16.55351: tcp 2920
11:46:17.160302 IP 192.168.1.22.8000 > 192.168.1.16.55351: tcp 2920
11:46:17.160355 IP 192.168.1.22.8000 > 192.168.1.16.55350: tcp 74
11:46:17.160421 IP 192.168.1.22.8000 > 192.168.1.16.55351: tcp 1460
11:46:17.163321 IP 192.168.1.16.55353 > 192.168.1.22.8000: tcp 0
11:46:17.163380 IP 192.168.1.16.55352 > 192.168.1.22.8000: tcp 0
11:46:17.163386 IP 192.168.1.16.55352 > 192.168.1.22.8000: tcp 987
11:46:17.163394 IP 192.168.1.22.8000 > 192.168.1.16.55352: tcp 0
11:46:17.163469 IP 192.168.1.16.55353 > 192.168.1.22.8000: tcp 979
11:46:17.163486 IP 192.168.1.22.8000 > 192.168.1.16.55353: tcp 0
11:46:17.163495 IP 192.168.1.16.55349 > 192.168.1.22.8000: tcp 0
11:46:17.163528 IP 192.168.1.22.8000 > 192.168.1.16.55349: tcp 5840
11:46:17.163758 IP 192.168.1.22.8000 > 192.168.1.16.55352: tcp 123
11:46:17.163828 IP 192.168.1.22.8000 > 192.168.1.16.55353: tcp 125
11:46:17.163846 IP 192.168.1.22.8000 > 192.168.1.16.55352: tcp 2920
11:46:17.163923 IP 192.168.1.22.8000 > 192.168.1.16.55353: tcp 2920
11:46:17.163949 IP 192.168.1.22.8000 > 192.168.1.16.55353: tcp 2920
11:46:17.163966 IP 192.168.1.22.8000 > 192.168.1.16.55353: tcp 2920
11:46:17.163978 IP 192.168.1.22.8000 > 192.168.1.16.55353: tcp 2920
11:46:17.164002 IP 192.168.1.22.8000 > 192.168.1.16.55353: tcp 1460
11:46:17.164020 IP 192.168.1.22.8000 > 192.168.1.16.55352: tcp 75
11:46:17.164408 IP 192.168.1.16.55349 > 192.168.1.22.8000: tcp 0
11:46:17.164462 IP 192.168.1.16.55349 > 192.168.1.22.8000: tcp 0
11:46:17.164484 IP 192.168.1.22.8000 > 192.168.1.16.55349: tcp 11680
11:46:17.164534 IP 192.168.1.16.55349 > 192.168.1.22.8000: tcp 0
11:46:17.164582 IP 192.168.1.16.55349 > 192.168.1.22.8000: tcp 0
11:46:17.164597 IP 192.168.1.22.8000 > 192.168.1.16.55349: tcp 11680
11:46:17.164646 IP 192.168.1.16.55354 > 192.168.1.22.8000: tcp 0
11:46:17.164665 IP 192.168.1.16.55354 > 192.168.1.22.8000: tcp 976
11:46:17.164668 IP 192.168.1.22.8000 > 192.168.1.16.55354: tcp 0
11:46:17.164672 IP 192.168.1.16.55350 > 192.168.1.22.8000: tcp 0
11:46:17.164700 IP 192.168.1.16.55350 > 192.168.1.22.8000: tcp 0
11:46:17.164740 IP 192.168.1.16.55351 > 192.168.1.22.8000: tcp 0
11:46:17.164767 IP 192.168.1.22.8000 > 192.168.1.16.55351: tcp 4380
11:46:17.164785 IP 192.168.1.16.55351 > 192.168.1.22.8000: tcp 0
11:46:17.164788 IP 192.168.1.22.8000 > 192.168.1.16.55351: tcp 4380
11:46:17.164795 IP 192.168.1.16.55351 > 192.168.1.22.8000: tcp 0
11:46:17.164797 IP 192.168.1.22.8000 > 192.168.1.16.55351: tcp 5840
11:46:17.164818 IP 192.168.1.16.55351 > 192.168.1.22.8000: tcp 0
11:46:17.164834 IP 192.168.1.16.55350 > 192.168.1.22.8000: tcp 0
11:46:17.164855 IP 192.168.1.16.55350 > 192.168.1.22.8000: tcp 0
11:46:17.164873 IP 192.168.1.22.8000 > 192.168.1.16.55350: tcp 0
11:46:17.164884 IP 192.168.1.16.55355 > 192.168.1.22.8000: tcp 0
11:46:17.164890 IP 192.168.1.22.8000 > 192.168.1.16.55355: tcp 0
11:46:17.164897 IP 192.168.1.16.55351 > 192.168.1.22.8000: tcp 0
11:46:17.169573 IP 192.168.1.16.55349 > 192.168.1.22.8000: tcp 0
11:46:17.169597 IP 192.168.1.22.8000 > 192.168.1.16.55349: tcp 2920
11:46:17.177952 IP 192.168.1.16.55353 > 192.168.1.22.8000: tcp 0
11:46:17.178003 IP 192.168.1.22.8000 > 192.168.1.16.55353: tcp 2920
11:46:17.178021 IP 192.168.1.22.8000 > 192.168.1.16.55353: tcp 2920
11:46:17.178039 IP 192.168.1.16.55349 > 192.168.1.22.8000: tcp 0
11:46:17.178067 IP 192.168.1.22.8000 > 192.168.1.16.55349: tcp 8760
11:46:17.178094 IP 192.168.1.16.55352 > 192.168.1.22.8000: tcp 0
11:46:17.178135 IP 192.168.1.16.55353 > 192.168.1.22.8000: tcp 0
11:46:17.178193 IP 192.168.1.22.8000 > 192.168.1.16.55354: tcp 1460
11:46:17.178199 IP 192.168.1.16.55353 > 192.168.1.22.8000: tcp 0
11:46:17.178234 IP 192.168.1.16.55353 > 192.168.1.22.8000: tcp 0
11:46:17.178236 IP 192.168.1.16.55353 > 192.168.1.22.8000: tcp 0
11:46:17.178238 IP 192.168.1.16.55352 > 192.168.1.22.8000: tcp 0
11:46:17.178262 IP 192.168.1.16.55352 > 192.168.1.22.8000: tcp 0
11:46:17.178282 IP 192.168.1.22.8000 > 192.168.1.16.55352: tcp 0
11:46:17.178310 IP 192.168.1.16.55349 > 192.168.1.22.8000: tcp 0
11:46:17.178327 IP 192.168.1.16.55356 > 192.168.1.22.8000: tcp 0
11:46:17.178355 IP 192.168.1.22.8000 > 192.168.1.16.55356: tcp 0
11:46:17.178361 IP 192.168.1.16.55349 > 192.168.1.22.8000: tcp 0
11:46:17.178363 IP 192.168.1.22.8000 > 192.168.1.16.55349: tcp 10220
11:46:17.178372 IP 192.168.1.16.55349 > 192.168.1.22.8000: tcp 0
11:46:17.178381 IP 192.168.1.22.8000 > 192.168.1.16.55349: tcp 10220
11:46:17.178399 IP 192.168.1.16.55349 > 192.168.1.22.8000: tcp 0
11:46:17.178401 IP 192.168.1.16.55349 > 192.168.1.22.8000: tcp 0
11:46:17.178403 IP 192.168.1.16.55349 > 192.168.1.22.8000: tcp 0
11:46:17.178421 IP 192.168.1.16.55349 > 192.168.1.22.8000: tcp 0
11:46:17.178468 IP 192.168.1.16.55351 > 192.168.1.22.8000: tcp 0
11:46:17.178472 IP 192.168.1.22.8000 > 192.168.1.16.55351: tcp 5840
11:46:17.178482 IP 192.168.1.16.55351 > 192.168.1.22.8000: tcp 0
11:46:17.178485 IP 192.168.1.22.8000 > 192.168.1.16.55351: tcp 5840
11:46:17.178492 IP 192.168.1.16.55351 > 192.168.1.22.8000: tcp 0
11:46:17.178494 IP 192.168.1.16.55351 > 192.168.1.22.8000: tcp 0
11:46:17.178495 IP 192.168.1.16.55355 > 192.168.1.22.8000: tcp 0
11:46:17.178514 IP 192.168.1.16.55351 > 192.168.1.22.8000: tcp 0
11:46:17.178527 IP 192.168.1.16.55355 > 192.168.1.22.8000: tcp 983
11:46:17.178529 IP 192.168.1.22.8000 > 192.168.1.16.55355: tcp 0
11:46:17.178538 IP 192.168.1.16.55351 > 192.168.1.22.8000: tcp 0
11:46:17.178540 IP 192.168.1.16.55351 > 192.168.1.22.8000: tcp 0
11:46:17.178542 IP 192.168.1.16.55351 > 192.168.1.22.8000: tcp 0
11:46:17.178544 IP 192.168.1.16.55351 > 192.168.1.22.8000: tcp 0
11:46:17.178657 IP 192.168.1.22.8000 > 192.168.1.16.55351: tcp 4666
11:46:17.178698 IP 192.168.1.22.8000 > 192.168.1.16.55349: tcp 2920
11:46:17.178705 IP 192.168.1.22.8000 > 192.168.1.16.55349: tcp 10220
11:46:17.178725 IP 192.168.1.22.8000 > 192.168.1.16.55349: tcp 10220
11:46:17.178743 IP 192.168.1.22.8000 > 192.168.1.16.55353: tcp 2920
11:46:17.178750 IP 192.168.1.22.8000 > 192.168.1.16.55353: tcp 4380
11:46:17.178754 IP 192.168.1.22.8000 > 192.168.1.16.55353: tcp 4380
11:46:17.178768 IP 192.168.1.22.8000 > 192.168.1.16.55355: tcp 123
11:46:17.178769 IP 192.168.1.22.8000 > 192.168.1.16.55355: tcp 2920
11:46:17.178923 IP 192.168.1.22.8000 > 192.168.1.16.55353: tcp 4380
11:46:17.178965 IP 192.168.1.22.8000 > 192.168.1.16.55353: tcp 4380
11:46:17.178977 IP 192.168.1.22.8000 > 192.168.1.16.55353: tcp 2920
11:46:17.178994 IP 192.168.1.22.8000 > 192.168.1.16.55355: tcp 1460
11:46:17.179029 IP 192.168.1.22.8000 > 192.168.1.16.55355: tcp 1113
11:46:17.182664 IP 192.168.1.16.55354 > 192.168.1.22.8000: tcp 0
11:46:17.182712 IP 192.168.1.22.8000 > 192.168.1.16.55354: tcp 4380
11:46:17.182731 IP 192.168.1.16.55354 > 192.168.1.22.8000: tcp 0
11:46:17.182748 IP 192.168.1.22.8000 > 192.168.1.16.55354: tcp 4380
11:46:17.182758 IP 192.168.1.16.55354 > 192.168.1.22.8000: tcp 0
11:46:17.182761 IP 192.168.1.16.55354 > 192.168.1.22.8000: tcp 0
11:46:17.182763 IP 192.168.1.16.55351 > 192.168.1.22.8000: tcp 0
11:46:17.182767 IP 192.168.1.16.55354 > 192.168.1.22.8000: tcp 0
11:46:17.182793 IP 192.168.1.16.55349 > 192.168.1.22.8000: tcp 0
11:46:17.182797 IP 192.168.1.22.8000 > 192.168.1.16.55349: tcp 5840
11:46:17.182882 IP 192.168.1.22.8000 > 192.168.1.16.55354: tcp 4380
11:46:17.182921 IP 192.168.1.22.8000 > 192.168.1.16.55354: tcp 4380
11:46:17.182950 IP 192.168.1.22.8000 > 192.168.1.16.55354: tcp 4380
11:46:17.182956 IP 192.168.1.22.8000 > 192.168.1.16.55354: tcp 4380
11:46:17.183048 IP 192.168.1.22.8000 > 192.168.1.16.55354: tcp 1460
11:46:17.187439 IP 192.168.1.16.55353 > 192.168.1.22.8000: tcp 0
11:46:17.187485 IP 192.168.1.22.8000 > 192.168.1.16.55353: tcp 2920
11:46:17.187508 IP 192.168.1.16.55353 > 192.168.1.22.8000: tcp 0
11:46:17.187525 IP 192.168.1.22.8000 > 192.168.1.16.55353: tcp 5840
11:46:17.187544 IP 192.168.1.16.55349 > 192.168.1.22.8000: tcp 0
11:46:17.187586 IP 192.168.1.22.8000 > 192.168.1.16.55349: tcp 2920
11:46:17.187608 IP 192.168.1.16.55349 > 192.168.1.22.8000: tcp 0
11:46:17.187647 IP 192.168.1.22.8000 > 192.168.1.16.55349: tcp 2920
11:46:17.187670 IP 192.168.1.16.55349 > 192.168.1.22.8000: tcp 0
11:46:17.187705 IP 192.168.1.16.55356 > 192.168.1.22.8000: tcp 0
11:46:17.187732 IP 192.168.1.16.55356 > 192.168.1.22.8000: tcp 984
11:46:17.187746 IP 192.168.1.22.8000 > 192.168.1.16.55356: tcp 0
11:46:17.187757 IP 192.168.1.16.55349 > 192.168.1.22.8000: tcp 0
11:46:17.187759 IP 192.168.1.16.55349 > 192.168.1.22.8000: tcp 0
11:46:17.187761 IP 192.168.1.16.55349 > 192.168.1.22.8000: tcp 0
11:46:17.187944 IP 192.168.1.22.8000 > 192.168.1.16.55349: tcp 2920
11:46:17.187995 IP 192.168.1.22.8000 > 192.168.1.16.55356: tcp 124
11:46:17.188008 IP 192.168.1.22.8000 > 192.168.1.16.55356: tcp 2920
11:46:17.188010 IP 192.168.1.22.8000 > 192.168.1.16.55356: tcp 2920
11:46:17.188028 IP 192.168.1.22.8000 > 192.168.1.16.55349: tcp 5840
11:46:17.188064 IP 192.168.1.22.8000 > 192.168.1.16.55356: tcp 2920
11:46:17.188071 IP 192.168.1.22.8000 > 192.168.1.16.55356: tcp 2920
11:46:17.188140 IP 192.168.1.22.8000 > 192.168.1.16.55356: tcp 1460
11:46:17.188193 IP 192.168.1.22.8000 > 192.168.1.16.55349: tcp 1251
11:46:17.192018 IP 192.168.1.16.55349 > 192.168.1.22.8000: tcp 0
11:46:17.192069 IP 192.168.1.16.55349 > 192.168.1.22.8000: tcp 0
11:46:17.192106 IP 192.168.1.16.55349 > 192.168.1.22.8000: tcp 0
11:46:17.192133 IP 192.168.1.16.55349 > 192.168.1.22.8000: tcp 0
11:46:17.192159 IP 192.168.1.16.55351 > 192.168.1.22.8000: tcp 0
11:46:17.192186 IP 192.168.1.16.55351 > 192.168.1.22.8000: tcp 0
11:46:17.192211 IP 192.168.1.16.55351 > 192.168.1.22.8000: tcp 0
11:46:17.192315 IP 192.168.1.16.55351 > 192.168.1.22.8000: tcp 0
11:46:17.192330 IP 192.168.1.16.55351 > 192.168.1.22.8000: tcp 0
11:46:17.192345 IP 192.168.1.22.8000 > 192.168.1.16.55351: tcp 0
11:46:17.192364 IP 192.168.1.16.55357 > 192.168.1.22.8000: tcp 0
11:46:17.192369 IP 192.168.1.22.8000 > 192.168.1.16.55357: tcp 0
11:46:17.192376 IP 192.168.1.16.55349 > 192.168.1.22.8000: tcp 0
11:46:17.192413 IP 192.168.1.16.55349 > 192.168.1.22.8000: tcp 0
11:46:17.201090 IP 192.168.1.22.8000 > 192.168.1.16.55356: tcp 1460
11:46:17.201664 IP 192.168.1.16.55349 > 192.168.1.22.8000: tcp 0
11:46:17.201717 IP 192.168.1.16.55349 > 192.168.1.22.8000: tcp 0
11:46:17.201747 IP 192.168.1.16.55349 > 192.168.1.22.8000: tcp 0
11:46:17.201775 IP 192.168.1.16.55349 > 192.168.1.22.8000: tcp 0
11:46:17.201804 IP 192.168.1.16.55349 > 192.168.1.22.8000: tcp 0
11:46:17.201835 IP 192.168.1.16.55349 > 192.168.1.22.8000: tcp 0
11:46:17.201873 IP 192.168.1.16.55353 > 192.168.1.22.8000: tcp 0
11:46:17.201887 IP 192.168.1.22.8000 > 192.168.1.16.55353: tcp 5840
11:46:17.201913 IP 192.168.1.16.55353 > 192.168.1.22.8000: tcp 0
11:46:17.201916 IP 192.168.1.22.8000 > 192.168.1.16.55353: tcp 5840
11:46:17.201937 IP 192.168.1.16.55353 > 192.168.1.22.8000: tcp 0
11:46:17.201940 IP 192.168.1.16.55353 > 192.168.1.22.8000: tcp 0
11:46:17.201942 IP 192.168.1.16.55355 > 192.168.1.22.8000: tcp 0
11:46:17.202113 IP 192.168.1.16.55353 > 192.168.1.22.8000: tcp 0
11:46:17.202145 IP 192.168.1.16.55353 > 192.168.1.22.8000: tcp 0
11:46:17.202148 IP 192.168.1.16.55353 > 192.168.1.22.8000: tcp 0
11:46:17.202164 IP 192.168.1.16.55353 > 192.168.1.22.8000: tcp 0
11:46:17.202177 IP 192.168.1.16.55355 > 192.168.1.22.8000: tcp 0
11:46:17.202220 IP 192.168.1.16.55355 > 192.168.1.22.8000: tcp 0
11:46:17.202256 IP 192.168.1.16.55355 > 192.168.1.22.8000: tcp 0
11:46:17.202290 IP 192.168.1.22.8000 > 192.168.1.16.55355: tcp 0
11:46:17.202314 IP 192.168.1.16.55358 > 192.168.1.22.8000: tcp 0
11:46:17.202322 IP 192.168.1.22.8000 > 192.168.1.16.55358: tcp 0
11:46:17.202338 IP 192.168.1.16.55354 > 192.168.1.22.8000: tcp 0
11:46:17.202365 IP 192.168.1.22.8000 > 192.168.1.16.55354: tcp 2920
11:46:17.202390 IP 192.168.1.16.55354 > 192.168.1.22.8000: tcp 0
11:46:17.202393 IP 192.168.1.22.8000 > 192.168.1.16.55354: tcp 4380
11:46:17.202400 IP 192.168.1.22.8000 > 192.168.1.16.55354: tcp 4380
11:46:17.202426 IP 192.168.1.16.55354 > 192.168.1.22.8000: tcp 0
11:46:17.202462 IP 192.168.1.16.55349 > 192.168.1.22.8000: tcp 0
11:46:17.202511 IP 192.168.1.16.55349 > 192.168.1.22.8000: tcp 0
11:46:17.203103 IP 192.168.1.22.8000 > 192.168.1.16.55354: tcp 4380
11:46:17.203154 IP 192.168.1.22.8000 > 192.168.1.16.55353: tcp 4380
11:46:17.203175 IP 192.168.1.22.8000 > 192.168.1.16.55353: tcp 5840
11:46:17.203359 IP 192.168.1.22.8000 > 192.168.1.16.55353: tcp 4380
11:46:17.203430 IP 192.168.1.22.8000 > 192.168.1.16.55353: tcp 5840
11:46:17.203464 IP 192.168.1.22.8000 > 192.168.1.16.55353: tcp 5840
11:46:17.203494 IP 192.168.1.22.8000 > 192.168.1.16.55353: tcp 5840
11:46:17.203585 IP 192.168.1.22.8000 > 192.168.1.16.55353: tcp 5840
11:46:17.210628 IP 192.168.1.16.55354 > 192.168.1.22.8000: tcp 0
11:46:17.210666 IP 192.168.1.22.8000 > 192.168.1.16.55354: tcp 4380
11:46:17.210697 IP 192.168.1.16.55354 > 192.168.1.22.8000: tcp 0
11:46:17.210711 IP 192.168.1.22.8000 > 192.168.1.16.55354: tcp 4380
11:46:17.210719 IP 192.168.1.16.55354 > 192.168.1.22.8000: tcp 0
11:46:17.210721 IP 192.168.1.16.55354 > 192.168.1.22.8000: tcp 0
11:46:17.210723 IP 192.168.1.16.55354 > 192.168.1.22.8000: tcp 0
11:46:17.210743 IP 192.168.1.16.55354 > 192.168.1.22.8000: tcp 0
11:46:17.210763 IP 192.168.1.16.55354 > 192.168.1.22.8000: tcp 0
11:46:17.211318 IP 192.168.1.22.8000 > 192.168.1.16.55354: tcp 4380
11:46:17.211353 IP 192.168.1.22.8000 > 192.168.1.16.55354: tcp 4380
11:46:17.211442 IP 192.168.1.22.8000 > 192.168.1.16.55354: tcp 1460
11:46:17.211487 IP 192.168.1.22.8000 > 192.168.1.16.55354: tcp 4380
11:46:17.211508 IP 192.168.1.22.8000 > 192.168.1.16.55354: tcp 4380
11:46:17.211525 IP 192.168.1.22.8000 > 192.168.1.16.55354: tcp 4380
11:46:17.211601 IP 192.168.1.22.8000 > 192.168.1.16.55354: tcp 4380
11:46:17.211639 IP 192.168.1.22.8000 > 192.168.1.16.55354: tcp 4380
11:46:17.211668 IP 192.168.1.22.8000 > 192.168.1.16.55354: tcp 1460
11:46:17.220363 IP 192.168.1.16.55353 > 192.168.1.22.8000: tcp 0
11:46:17.220418 IP 192.168.1.22.8000 > 192.168.1.16.55353: tcp 4380
11:46:17.220459 IP 192.168.1.16.55353 > 192.168.1.22.8000: tcp 0
11:46:17.220462 IP 192.168.1.22.8000 > 192.168.1.16.55353: tcp 4380
11:46:17.220467 IP 192.168.1.16.55353 > 192.168.1.22.8000: tcp 0
11:46:17.220469 IP 192.168.1.16.55349 > 192.168.1.22.8000: tcp 0
11:46:17.220529 IP 192.168.1.16.55349 > 192.168.1.22.8000: tcp 0
11:46:17.220572 IP 192.168.1.16.55349 > 192.168.1.22.8000: tcp 0
11:46:17.220611 IP 192.168.1.16.55356 > 192.168.1.22.8000: tcp 0
11:46:17.220631 IP 192.168.1.22.8000 > 192.168.1.16.55356: tcp 2920
11:46:17.220640 IP 192.168.1.22.8000 > 192.168.1.16.55356: tcp 1460
11:46:17.220659 IP 192.168.1.16.55356 > 192.168.1.22.8000: tcp 0
11:46:17.220704 IP 192.168.1.22.8000 > 192.168.1.16.55356: tcp 2920
11:46:17.220721 IP 192.168.1.16.55349 > 192.168.1.22.8000: tcp 0
11:46:17.220754 IP 192.168.1.16.55349 > 192.168.1.22.8000: tcp 0
11:46:17.220795 IP 192.168.1.16.55356 > 192.168.1.22.8000: tcp 0
11:46:17.220810 IP 192.168.1.16.55357 > 192.168.1.22.8000: tcp 0
11:46:17.220834 IP 192.168.1.16.55357 > 192.168.1.22.8000: tcp 985
11:46:17.220837 IP 192.168.1.22.8000 > 192.168.1.16.55357: tcp 0
11:46:17.220846 IP 192.168.1.16.55353 > 192.168.1.22.8000: tcp 0
11:46:17.220886 IP 192.168.1.16.55356 > 192.168.1.22.8000: tcp 0
11:46:17.220897 IP 192.168.1.16.55349 > 192.168.1.22.8000: tcp 0
11:46:17.221168 IP 192.168.1.22.8000 > 192.168.1.16.55356: tcp 2920
11:46:17.221203 IP 192.168.1.22.8000 > 192.168.1.16.55357: tcp 123
11:46:17.221204 IP 192.168.1.22.8000 > 192.168.1.16.55357: tcp 2920
11:46:17.221205 IP 192.168.1.22.8000 > 192.168.1.16.55357: tcp 2920
11:46:17.221209 IP 192.168.1.22.8000 > 192.168.1.16.55356: tcp 897
11:46:17.221226 IP 192.168.1.22.8000 > 192.168.1.16.55353: tcp 4380
11:46:17.221387 IP 192.168.1.22.8000 > 192.168.1.16.55357: tcp 61
11:46:17.224281 IP 192.168.1.16.55349 > 192.168.1.22.8000: tcp 0
11:46:17.224314 IP 192.168.1.22.8000 > 192.168.1.16.55349: tcp 0
11:46:17.224325 IP 192.168.1.16.55359 > 192.168.1.22.8000: tcp 0
11:46:17.224332 IP 192.168.1.22.8000 > 192.168.1.16.55359: tcp 0
11:46:17.224337 IP 192.168.1.16.55353 > 192.168.1.22.8000: tcp 0
11:46:17.224351 IP 192.168.1.22.8000 > 192.168.1.16.55353: tcp 5840
11:46:17.224360 IP 192.168.1.16.55353 > 192.168.1.22.8000: tcp 0
11:46:17.224363 IP 192.168.1.16.55358 > 192.168.1.22.8000: tcp 0
11:46:17.224385 IP 192.168.1.16.55353 > 192.168.1.22.8000: tcp 0
11:46:17.224397 IP 192.168.1.22.8000 > 192.168.1.16.55353: tcp 5840
11:46:17.225225 IP 192.168.1.16.55358 > 192.168.1.22.8000: tcp 984
11:46:17.225254 IP 192.168.1.22.8000 > 192.168.1.16.55358: tcp 0
11:46:17.225265 IP 192.168.1.16.55354 > 192.168.1.22.8000: tcp 0
11:46:17.225294 IP 192.168.1.22.8000 > 192.168.1.16.55354: tcp 4380
11:46:17.225313 IP 192.168.1.16.55354 > 192.168.1.22.8000: tcp 0
11:46:17.225318 IP 192.168.1.22.8000 > 192.168.1.16.55354: tcp 4380
11:46:17.225325 IP 192.168.1.16.55354 > 192.168.1.22.8000: tcp 0
11:46:17.225329 IP 192.168.1.16.55354 > 192.168.1.22.8000: tcp 0
11:46:17.225331 IP 192.168.1.16.55354 > 192.168.1.22.8000: tcp 0
11:46:17.225333 IP 192.168.1.16.55353 > 192.168.1.22.8000: tcp 0
11:46:17.225349 IP 192.168.1.22.8000 > 192.168.1.16.55353: tcp 5676
11:46:17.225367 IP 192.168.1.16.55353 > 192.168.1.22.8000: tcp 0
11:46:17.225371 IP 192.168.1.16.55353 > 192.168.1.22.8000: tcp 0
11:46:17.225373 IP 192.168.1.22.8000 > 192.168.1.16.55353: tcp 4380
11:46:17.225381 IP 192.168.1.16.55353 > 192.168.1.22.8000: tcp 0
11:46:17.225456 IP 192.168.1.22.8000 > 192.168.1.16.55353: tcp 4380
11:46:17.225491 IP 192.168.1.22.8000 > 192.168.1.16.55354: tcp 4380
11:46:17.225512 IP 192.168.1.22.8000 > 192.168.1.16.55354: tcp 5840
11:46:17.226040 IP 192.168.1.22.8000 > 192.168.1.16.55358: tcp 124
11:46:17.226084 IP 192.168.1.22.8000 > 192.168.1.16.55358: tcp 2920
11:46:17.226120 IP 192.168.1.22.8000 > 192.168.1.16.55358: tcp 2920
11:46:17.226127 IP 192.168.1.22.8000 > 192.168.1.16.55358: tcp 2920
11:46:17.226256 IP 192.168.1.22.8000 > 192.168.1.16.55358: tcp 2920
11:46:17.226290 IP 192.168.1.22.8000 > 192.168.1.16.55358: tcp 1460
11:46:17.226337 IP 192.168.1.22.8000 > 192.168.1.16.55358: tcp 1215
11:46:17.229179 IP 192.168.1.16.55353 > 192.168.1.22.8000: tcp 0
11:46:17.229220 IP 192.168.1.22.8000 > 192.168.1.16.55353: tcp 1624
11:46:17.229237 IP 192.168.1.16.55353 > 192.168.1.22.8000: tcp 0
11:46:17.229255 IP 192.168.1.22.8000 > 192.168.1.16.55353: tcp 2920
11:46:17.229263 IP 192.168.1.16.55353 > 192.168.1.22.8000: tcp 0
11:46:17.229266 IP 192.168.1.22.8000 > 192.168.1.16.55353: tcp 2920
11:46:17.229286 IP 192.168.1.16.55353 > 192.168.1.22.8000: tcp 0
11:46:17.229299 IP 192.168.1.16.55353 > 192.168.1.22.8000: tcp 0
11:46:17.229317 IP 192.168.1.16.55353 > 192.168.1.22.8000: tcp 0
11:46:17.229319 IP 192.168.1.16.55353 > 192.168.1.22.8000: tcp 0
11:46:17.229320 IP 192.168.1.16.55353 > 192.168.1.22.8000: tcp 0
11:46:17.229322 IP 192.168.1.16.55353 > 192.168.1.22.8000: tcp 0
11:46:17.229323 IP 192.168.1.16.55354 > 192.168.1.22.8000: tcp 0
11:46:17.229338 IP 192.168.1.22.8000 > 192.168.1.16.55354: tcp 5676
11:46:17.229362 IP 192.168.1.16.55354 > 192.168.1.22.8000: tcp 0
11:46:17.229365 IP 192.168.1.16.55354 > 192.168.1.22.8000: tcp 0
11:46:17.229368 IP 192.168.1.22.8000 > 192.168.1.16.55354: tcp 5840
11:46:17.229375 IP 192.168.1.16.55354 > 192.168.1.22.8000: tcp 0
11:46:17.229377 IP 192.168.1.16.55354 > 192.168.1.22.8000: tcp 0
11:46:17.229379 IP 192.168.1.16.55354 > 192.168.1.22.8000: tcp 0
11:46:17.229381 IP 192.168.1.22.8000 > 192.168.1.16.55354: tcp 7300
11:46:17.229388 IP 192.168.1.16.55354 > 192.168.1.22.8000: tcp 0
11:46:17.229472 IP 192.168.1.22.8000 > 192.168.1.16.55354: tcp 2920
11:46:17.229528 IP 192.168.1.22.8000 > 192.168.1.16.55353: tcp 2920
11:46:17.229545 IP 192.168.1.22.8000 > 192.168.1.16.55353: tcp 2920
11:46:17.229566 IP 192.168.1.22.8000 > 192.168.1.16.55354: tcp 164
11:46:17.229605 IP 192.168.1.22.8000 > 192.168.1.16.55353: tcp 2920
11:46:17.229640 IP 192.168.1.22.8000 > 192.168.1.16.55353: tcp 2920
11:46:17.229657 IP 192.168.1.22.8000 > 192.168.1.16.55353: tcp 2920
11:46:17.229715 IP 192.168.1.22.8000 > 192.168.1.16.55353: tcp 2920
11:46:17.230623 IP 192.168.1.16.55354 > 192.168.1.22.8000: tcp 0
11:46:17.230647 IP 192.168.1.22.8000 > 192.168.1.16.55354: tcp 2920
11:46:17.230684 IP 192.168.1.16.55354 > 192.168.1.22.8000: tcp 0
11:46:17.230706 IP 192.168.1.22.8000 > 192.168.1.16.55354: tcp 2920
11:46:17.230744 IP 192.168.1.16.55354 > 192.168.1.22.8000: tcp 0
11:46:17.230757 IP 192.168.1.22.8000 > 192.168.1.16.55354: tcp 2920
11:46:17.230789 IP 192.168.1.16.55354 > 192.168.1.22.8000: tcp 0
11:46:17.230814 IP 192.168.1.16.55354 > 192.168.1.22.8000: tcp 0
11:46:17.230816 IP 192.168.1.16.55354 > 192.168.1.22.8000: tcp 0
11:46:17.230818 IP 192.168.1.16.55354 > 192.168.1.22.8000: tcp 0
11:46:17.230819 IP 192.168.1.16.55354 > 192.168.1.22.8000: tcp 0
11:46:17.230820 IP 192.168.1.16.55353 > 192.168.1.22.8000: tcp 0
11:46:17.230833 IP 192.168.1.22.8000 > 192.168.1.16.55353: tcp 2920
11:46:17.230875 IP 192.168.1.16.55353 > 192.168.1.22.8000: tcp 0
11:46:17.230887 IP 192.168.1.22.8000 > 192.168.1.16.55353: tcp 2920
11:46:17.230921 IP 192.168.1.16.55353 > 192.168.1.22.8000: tcp 0
11:46:17.230933 IP 192.168.1.16.55356 > 192.168.1.22.8000: tcp 0
11:46:17.230966 IP 192.168.1.16.55356 > 192.168.1.22.8000: tcp 0
11:46:17.231012 IP 192.168.1.16.55356 > 192.168.1.22.8000: tcp 0
11:46:17.231056 IP 192.168.1.16.55356 > 192.168.1.22.8000: tcp 0
11:46:17.237301 IP 192.168.1.22.8000 > 192.168.1.16.55353: tcp 2920
11:46:17.237356 IP 192.168.1.22.8000 > 192.168.1.16.55354: tcp 2920
11:46:17.237372 IP 192.168.1.22.8000 > 192.168.1.16.55354: tcp 5840
11:46:17.237390 IP 192.168.1.22.8000 > 192.168.1.16.55354: tcp 908
11:46:17.240104 IP 192.168.1.16.55357 > 192.168.1.22.8000: tcp 0
11:46:17.250742 IP 192.168.1.16.55357 > 192.168.1.22.8000: tcp 0
11:46:17.250790 IP 192.168.1.16.55356 > 192.168.1.22.8000: tcp 0
11:46:17.250807 IP 192.168.1.16.55356 > 192.168.1.22.8000: tcp 0
11:46:17.250822 IP 192.168.1.22.8000 > 192.168.1.16.55356: tcp 0
11:46:17.250834 IP 192.168.1.16.55360 > 192.168.1.22.8000: tcp 0
11:46:17.250839 IP 192.168.1.22.8000 > 192.168.1.16.55360: tcp 0
11:46:17.250844 IP 192.168.1.16.55353 > 192.168.1.22.8000: tcp 0
11:46:17.250863 IP 192.168.1.22.8000 > 192.168.1.16.55353: tcp 2920
11:46:17.250881 IP 192.168.1.16.55357 > 192.168.1.22.8000: tcp 0
11:46:17.250906 IP 192.168.1.16.55357 > 192.168.1.22.8000: tcp 0
11:46:17.250918 IP 192.168.1.22.8000 > 192.168.1.16.55357: tcp 0
11:46:17.250925 IP 192.168.1.16.55361 > 192.168.1.22.8000: tcp 0
11:46:17.250927 IP 192.168.1.22.8000 > 192.168.1.16.55361: tcp 0
11:46:17.264837 IP 192.168.1.22.8000 > 192.168.1.16.55358: tcp 1215
11:46:17.276958 IP 192.168.1.22.8000 > 192.168.1.16.55354: tcp 908
11:46:17.293721 IP 192.168.1.16.55353 > 192.168.1.22.8000: tcp 0
11:46:17.293753 IP 192.168.1.22.8000 > 192.168.1.16.55353: tcp 1460
11:46:17.306488 IP 192.168.1.16.55359 > 192.168.1.22.8000: tcp 0
11:46:17.310654 IP 192.168.1.16.55359 > 192.168.1.22.8000: tcp 994
11:46:17.310691 IP 192.168.1.22.8000 > 192.168.1.16.55359: tcp 0
11:46:17.310703 IP 192.168.1.16.55353 > 192.168.1.22.8000: tcp 0
11:46:17.310717 IP 192.168.1.22.8000 > 192.168.1.16.55353: tcp 2920
11:46:17.310754 IP 192.168.1.16.55353 > 192.168.1.22.8000: tcp 0
11:46:17.310770 IP 192.168.1.22.8000 > 192.168.1.16.55353: tcp 2920
11:46:17.310800 IP 192.168.1.16.55353 > 192.168.1.22.8000: tcp 0
11:46:17.310811 IP 192.168.1.16.55353 > 192.168.1.22.8000: tcp 0
11:46:17.310823 IP 192.168.1.16.55354 > 192.168.1.22.8000: tcp 0
11:46:17.310865 IP 192.168.1.16.55354 > 192.168.1.22.8000: tcp 0
11:46:17.310892 IP 192.168.1.16.55354 > 192.168.1.22.8000: tcp 0
11:46:17.310930 IP 192.168.1.16.55353 > 192.168.1.22.8000: tcp 0
11:46:17.310947 IP 192.168.1.16.55353 > 192.168.1.22.8000: tcp 0
11:46:17.310948 IP 192.168.1.16.55353 > 192.168.1.22.8000: tcp 0
11:46:17.310959 IP 192.168.1.16.55353 > 192.168.1.22.8000: tcp 0
11:46:17.310969 IP 192.168.1.16.55353 > 192.168.1.22.8000: tcp 0
11:46:17.310985 IP 192.168.1.16.55354 > 192.168.1.22.8000: tcp 0
11:46:17.311014 IP 192.168.1.16.55354 > 192.168.1.22.8000: tcp 0
11:46:17.311050 IP 192.168.1.16.55354 > 192.168.1.22.8000: tcp 0
11:46:17.311144 IP 192.168.1.22.8000 > 192.168.1.16.55359: tcp 125
11:46:17.311199 IP 192.168.1.22.8000 > 192.168.1.16.55359: tcp 2920
11:46:17.311210 IP 192.168.1.22.8000 > 192.168.1.16.55359: tcp 2920
11:46:17.311228 IP 192.168.1.22.8000 > 192.168.1.16.55353: tcp 2920
11:46:17.311229 IP 192.168.1.22.8000 > 192.168.1.16.55353: tcp 2920
11:46:17.311236 IP 192.168.1.22.8000 > 192.168.1.16.55359: tcp 2920
11:46:17.311297 IP 192.168.1.22.8000 > 192.168.1.16.55353: tcp 2920
11:46:17.311357 IP 192.168.1.22.8000 > 192.168.1.16.55353: tcp 2920
11:46:17.311377 IP 192.168.1.22.8000 > 192.168.1.16.55359: tcp 2920
11:46:17.311387 IP 192.168.1.22.8000 > 192.168.1.16.55353: tcp 2920
11:46:17.311391 IP 192.168.1.22.8000 > 192.168.1.16.55353: tcp 2920
11:46:17.311395 IP 192.168.1.22.8000 > 192.168.1.16.55359: tcp 1460
11:46:17.311540 IP 192.168.1.22.8000 > 192.168.1.16.55353: tcp 2920
11:46:17.330717 IP 192.168.1.16.55358 > 192.168.1.22.8000: tcp 0
11:46:17.330799 IP 192.168.1.16.55358 > 192.168.1.22.8000: tcp 0
11:46:17.330832 IP 192.168.1.16.55358 > 192.168.1.22.8000: tcp 0
11:46:17.330880 IP 192.168.1.16.55358 > 192.168.1.22.8000: tcp 0
11:46:17.331018 IP 192.168.1.16.55358 > 192.168.1.22.8000: tcp 0
11:46:17.331040 IP 192.168.1.16.55353 > 192.168.1.22.8000: tcp 0
11:46:17.331060 IP 192.168.1.16.55358 > 192.168.1.22.8000: tcp 0
11:46:17.331086 IP 192.168.1.16.55358 > 192.168.1.22.8000: tcp 0
11:46:17.331118 IP 192.168.1.22.8000 > 192.168.1.16.55358: tcp 0
11:46:17.331164 IP 192.168.1.16.55362 > 192.168.1.22.8000: tcp 0
11:46:17.331179 IP 192.168.1.22.8000 > 192.168.1.16.55362: tcp 0
11:46:17.331184 IP 192.168.1.16.55353 > 192.168.1.22.8000: tcp 0
11:46:17.331197 IP 192.168.1.22.8000 > 192.168.1.16.55353: tcp 1460
11:46:17.331202 IP 192.168.1.16.55353 > 192.168.1.22.8000: tcp 0
11:46:17.331205 IP 192.168.1.22.8000 > 192.168.1.16.55353: tcp 2920
11:46:17.331212 IP 192.168.1.16.55353 > 192.168.1.22.8000: tcp 0
11:46:17.331223 IP 192.168.1.22.8000 > 192.168.1.16.55353: tcp 2920
11:46:17.331283 IP 192.168.1.16.55354 > 192.168.1.22.8000: tcp 0
11:46:17.332975 IP 192.168.1.16.55354 > 192.168.1.22.8000: tcp 0
11:46:17.333021 IP 192.168.1.16.55354 > 192.168.1.22.8000: tcp 0
11:46:17.335071 IP 192.168.1.16.55354 > 192.168.1.22.8000: tcp 0
11:46:17.335105 IP 192.168.1.16.55354 > 192.168.1.22.8000: tcp 0
11:46:17.335136 IP 192.168.1.16.55354 > 192.168.1.22.8000: tcp 0
11:46:17.335196 IP 192.168.1.16.55354 > 192.168.1.22.8000: tcp 0
11:46:17.335249 IP 192.168.1.16.55354 > 192.168.1.22.8000: tcp 0
11:46:17.335287 IP 192.168.1.16.55353 > 192.168.1.22.8000: tcp 0
11:46:17.335309 IP 192.168.1.22.8000 > 192.168.1.16.55353: tcp 2920
11:46:17.335324 IP 192.168.1.16.55353 > 192.168.1.22.8000: tcp 0
11:46:17.335335 IP 192.168.1.22.8000 > 192.168.1.16.55353: tcp 2920
11:46:17.335341 IP 192.168.1.16.55353 > 192.168.1.22.8000: tcp 0
11:46:17.342436 IP 192.168.1.16.55353 > 192.168.1.22.8000: tcp 0
11:46:17.342505 IP 192.168.1.16.55353 > 192.168.1.22.8000: tcp 0
11:46:17.342508 IP 192.168.1.16.55353 > 192.168.1.22.8000: tcp 0
11:46:17.342524 IP 192.168.1.16.55354 > 192.168.1.22.8000: tcp 0
11:46:17.342559 IP 192.168.1.16.55354 > 192.168.1.22.8000: tcp 0
11:46:17.342636 IP 192.168.1.16.55354 > 192.168.1.22.8000: tcp 0
11:46:17.342675 IP 192.168.1.16.55353 > 192.168.1.22.8000: tcp 0
11:46:17.342685 IP 192.168.1.16.55353 > 192.168.1.22.8000: tcp 0
11:46:17.342706 IP 192.168.1.16.55353 > 192.168.1.22.8000: tcp 0
11:46:17.342708 IP 192.168.1.16.55354 > 192.168.1.22.8000: tcp 0
11:46:17.342737 IP 192.168.1.16.55354 > 192.168.1.22.8000: tcp 0
11:46:17.342770 IP 192.168.1.16.55354 > 192.168.1.22.8000: tcp 0
11:46:17.342811 IP 192.168.1.16.55354 > 192.168.1.22.8000: tcp 0
11:46:17.342838 IP 192.168.1.16.55360 > 192.168.1.22.8000: tcp 0
11:46:17.342853 IP 192.168.1.16.55354 > 192.168.1.22.8000: tcp 0
11:46:17.342865 IP 192.168.1.22.8000 > 192.168.1.16.55354: tcp 0
11:46:17.342901 IP 192.168.1.16.55363 > 192.168.1.22.8000: tcp 0
11:46:17.342907 IP 192.168.1.22.8000 > 192.168.1.16.55363: tcp 0
11:46:17.342914 IP 192.168.1.16.55353 > 192.168.1.22.8000: tcp 0
11:46:17.342930 IP 192.168.1.16.55360 > 192.168.1.22.8000: tcp 985
11:46:17.342956 IP 192.168.1.22.8000 > 192.168.1.16.55360: tcp 0
11:46:17.342966 IP 192.168.1.16.55358 > 192.168.1.22.8000: tcp 0
11:46:17.342990 IP 192.168.1.16.55354 > 192.168.1.22.8000: tcp 0
11:46:17.342998 IP 192.168.1.16.55361 > 192.168.1.22.8000: tcp 0
11:46:17.343010 IP 192.168.1.16.55353 > 192.168.1.22.8000: tcp 0
11:46:17.343019 IP 192.168.1.16.55361 > 192.168.1.22.8000: tcp 982
11:46:17.343021 IP 192.168.1.22.8000 > 192.168.1.16.55361: tcp 0
11:46:17.343029 IP 192.168.1.16.55353 > 192.168.1.22.8000: tcp 0
11:46:17.343061 IP 192.168.1.16.55359 > 192.168.1.22.8000: tcp 0
11:46:17.343092 IP 192.168.1.22.8000 > 192.168.1.16.55359: tcp 2920
11:46:17.343109 IP 192.168.1.22.8000 > 192.168.1.16.55359: tcp 2920
11:46:17.343125 IP 192.168.1.16.55359 > 192.168.1.22.8000: tcp 0
11:46:17.343156 IP 192.168.1.16.55353 > 192.168.1.22.8000: tcp 0
11:46:17.343178 IP 192.168.1.16.55353 > 192.168.1.22.8000: tcp 0
11:46:17.343191 IP 192.168.1.16.55359 > 192.168.1.22.8000: tcp 0
11:46:17.343218 IP 192.168.1.16.55353 > 192.168.1.22.8000: tcp 0
11:46:17.343232 IP 192.168.1.16.55353 > 192.168.1.22.8000: tcp 0
11:46:17.343257 IP 192.168.1.16.55359 > 192.168.1.22.8000: tcp 0
11:46:17.343266 IP 192.168.1.16.55353 > 192.168.1.22.8000: tcp 0
11:46:17.343276 IP 192.168.1.16.55353 > 192.168.1.22.8000: tcp 0
11:46:17.343278 IP 192.168.1.16.55359 > 192.168.1.22.8000: tcp 0
11:46:17.343288 IP 192.168.1.16.55353 > 192.168.1.22.8000: tcp 0
